Link,Name,socot
https://www.lazada.vn/products/dong-ho-nam-day-thep-den-mat-sieu-mong-dizizid-dz24-cao-cap-thiet-ke-sang-trong-mat-den-day-den-tang-hop-cao-cap-i254092455-s343246535.html?search=1,Đồng hồ nam dây thép đen mặt siêu mỏng DIZIZID DZ24,120
https://www.lazada.vn/products/tang-vong-ty-huu-phong-thuy-may-man-dong-ho-nam-khac-rong-3d-sang-trong-danh-cho-quy-ong-dang-cap-i246757029-s317882396.html?search=1,Đồng Hồ Nam Khắc Rồng 3D Sang Trọng Dành Cho Quý Ông Đẳng Cấp,121
https://www.lazada.vn/products/dong-ho-nam-nibosi-1985-day-thep-duc-cao-cap-chay-6-kim-mdl-1985s-full-box-tang-vong-ty-huu-pin-i215710354-s270272853.html?search=1,Đồng hồ nam NIBOSI 1985 dây thép đúc cao cấp chạy 6 kim MDL-1985S,
https://www.lazada.vn/products/dong-ho-nam-nibosi-1985-cao-cap-hang-fullbox-day-du-phu-kien-ni2322-day-duc-may-chay-6-kim-i235294944-s299736551.html?search=1,"Đồng hồ Nam Nibosi 1985 cao cấp (Ni2322 dây đúc, máy chạy 6 kim)",
https://www.lazada.vn/products/dong-ho-co-nam-automatic-fngeen-f99-day-kim-loai-cao-cap-tang-vong-tay-phong-thuy-i211760051-s265095682.html?search=1,Đồng hồ cơ nam FNGEEN F99 dây kim loại cao cấp,124
https://www.lazada.vn/products/dong-ho-nam-nibosi-1985-day-duc-thep-khong-gi-day-luoi-i211163700-s275093370.html?search=1,"Đồng hồ nam Nibosi 1985 dây đúc, thép không gỉ (dây lưới)",
https://www.lazada.vn/products/dong-ho-nam-day-thep-dac-da-quang-ontheedge-036-fullbox-i168412942-s184287359.html?search=1,Đồng hồ nam dây thép đặc dạ quang Ontheedge 036,126
https://www.lazada.vn/products/dong-ho-nam-chay-3-kim-fngeen-fn001-day-demi-thep-khong-gi-i241089094-s308291338.html?search=1,ĐỒNG HỒ NAM CHẠY 3 KIM FNGEEN FN001,127
https://www.lazada.vn/products/dong-ho-nam-cuena-14-mat-den-day-da-sang-trong-tang-ngay-1-vong-phong-thuy-1-pin-du-phong-i238119677-s358904571.html?search=1,Đồng Hồ Nam CUENA 14 Mặt Đen Dây Da Sang Trọng,128
https://www.lazada.vn/products/khuyen-mai-khung-tang-vong-150000d-khi-mua-dong-ho-nam-mat-rong-vang-trang-cao-cap-i244539349-s420684040.html?search=1,Đồng hồ nam mặt rồng vàng trắng cao cấp,129
https://www.lazada.vn/products/dong-ho-thong-minh-dmt09-i102179684-s146631716.html?spm=a2o4n.searchlist.list.85.450f31f6oNf61M&search=1,Đồng Hồ Thông Minh DMT09,130
https://www.lazada.vn/products/dong-ho-cam-ung-gia-re-dz09-i135208482-s137061626.html?spm=a2o4n.searchlist.list.99.617431f6cIo26C&search=1,Đồng Hồ Cảm Ứng Giá Rẻ DZ09,131
https://www.lazada.vn/products/dong-ho-thong-minh-v8-mat-tron-sang-trong-i136147733-s138330888.html?spm=a2o4n.searchlist.list.25.617431f6O8WSBT&search=1,Đồng hồ thông minh V8 mặt tròn sang trọng,132
https://www.lazada.vn/products/dong-ho-nu-venus-korea-vien-da-sang-trong-tang-hop-pin-i255646958-s348513069.html?spm=a2o4n.searchlist.list.12.27c05b21DD4qqV&search=1,ĐỒNG HỒ NỮ VENUS KOREA Viền Đá Sang Trọng + TẶNG HỘP & PIN,133
https://www.lazada.vn/products/dong-ho-nam-nibosi-1985-day-da-tron-chay-6-kim-mdl-1985l-full-box-i136146264-s286807290.html?spm=a2o4n.searchlist.list.10.32295b73qKQqBD&search=1,Đồng hồ nam NIBOSI 1985 dây da trơn chạy 6 kim MDL-1985L (full box),
https://www.lazada.vn/products/dong-ho-nu-day-kim-loai-bewatch-hr1741-vang-i102144590-s102563455.html?spm=a2o4n.searchlist.list.144.7ae95b21D0aRpT&search=1,Đồng hồ nữ dây kim loại Be.Watch Hr1741 (Vàng),136
https://www.lazada.vn/products/dong-ho-thong-minh-smart-watch-a1-i107063940-s108399968.html?spm=a2o4n.searchlist.list.172.585131f6KTl10L&search=1,Đồng hồ thông minh Smart watch A1,137
https://www.lazada.vn/products/dong-ho-nam-thoi-trang-chong-nuoc-skmei-den-sk-010-i120086447-s120091504.html?spm=a2o4n.searchlist.list.31.40529e3b7X0Lq4&search=1,Đồng hồ nam thời trang chống nước Skmei ( Đen) SK 010,
https://www.lazada.vn/products/dong-ho-the-thao-led-skmei-1251-chong-tham-nuoc-mau-den-01-hop-cung-skmei-i135450768-s137439607.html?spm=a2o4n.searchlist.list.91.40529e3bKYpY7r&search=1,Đồng Hồ Thể Thao Led Skmei 1251 chống thấm nước ( Màu đen) + 01 hộp cứng SKMEI,
https://www.lazada.vn/products/dong-ho-nu-platrium-kieu-dang-sang-chanh-den-i161108757-s174855164.html?spm=a2o4n.searchlist.list.11.40529e3bIQDdxO&search=1,Đồng hồ nữ platrium kiểu dáng sang chảnh ( đen ),140
https://www.lazada.vn/products/dong-ho-nu-day-da-tong-hop-geneva-ge003-trang-i121590743-s121678633.html?spm=a2o4n.searchlist.list.70.40529e3bq32BHA&search=1,Đồng hồ nữ dây da tổng hợp Geneva GE003 (Trắng),141
https://www.lazada.vn/products/dong-ho-nam-day-thep-lua-den-mat-sieu-mong-dizizid-co-lich-ngay-cao-cap-full-hop-style-lich-lam-dz3n001-i190795820-s200846314.html?spm=a2o4n.searchlist.list.100.40529e3bFoWVgi&search=1,Đồng hồ nam dây thép lụa đen mặt siêu mỏng DIZIZID có lịch ngày cao cấp (Full hộp) - Style lịch lãm DZ3N001,142
https://www.lazada.vn/products/dong-ho-nam-den-led-phat-sang-jis-6541-mat-den-tang-kem-voucher-bao-hanh-idmuasam-i100421982-s100502323.html?spm=a2o4n.searchlist.list.1.46709e3bEHKxn4&search=1,[Có video quay thật] Đồng hồ nam dây thép không gỉ cao cấp Nary 2561 (Nhiều màu lựa chọn) + Tặng kèm voucher bảo hành IDMUASAM,
https://www.lazada.vn/products/dong-ho-nam-den-led-phat-sang-jis-6541-mat-den-tang-kem-voucher-bao-hanh-idmuasam-i100421982-s100502323.html?spm=a2o4n.searchlist.list.1.46709e3bEHKxn4&search=1,Đồng hồ nam đèn led phát sáng JIS 6541 (Mặt đen) + Tặng kèm voucher bảo hành IDMUASAM,144
https://www.lazada.vn/products/dong-ho-nu-day-cao-su-cao-cap-jis-2162-day-den-mat-trang-tang-kem-voucher-bao-hanh-idmuasam-i2021733-s2501330.html?spm=a2o4n.searchlist.list.5.46709e3b4OAtmy&search=1,Đồng hồ nữ dây cao su cao cấp JIS 2162 (Dây đen mặt trắng) + Tặng kèm voucher bảo hành IDMUASAM,145
https://www.lazada.vn/products/dong-ho-nam-thoi-trang-chong-nuoc-cao-cap-skmei-9096-xanh-003-i143200318-s147972672.html?spm=a2o4n.searchlist.list.9.46709e3bRu7Nid&search=1,Đồng hồ nam thời trang chống nước cao cấp Skmei 9096 ( Xanh ) 003,146
