Link,Name,socot
https://www.lazada.vn/products/dong-ho-nu-julius-han-quoc-day-da-ju1016-ja-844-xanh-den-i141566135-s145988571.html?search=1,Đồng hồ Nữ Julius Hàn Quốc Dây Da JU1016 JA-844 (Xanh Đen),
https://www.lazada.vn/products/dong-ho-thong-minh-xiaomi-amazfit-bip-hang-chinh-hang-i211151381-s264263575.html?search=1,Đồng Hồ Thông Minh Xiaomi Amazfit Bip - Hàng Chính Hãng,2
https://www.lazada.vn/products/dong-ho-thong-minh-smart-watch-uwatch-dz09-hang-nhap-khau-i101127877-s101304966.html?search=1,Đồng hồ thông minh Smart Watch Uwatch DZ09 - Hàng nhập khẩu,3
https://www.lazada.vn/products/dong-ho-thong-minh-smart-watch-a1-den-i106993165-s108321189.html?search=1,Đồng hồ thông minh Smart watch A1 (Đen),4
https://www.lazada.vn/products/dong-ho-thong-minh-c1-plus-i100979824-s313103813.html?search=1,Đồng hồ thông minh C1 Plus,5
https://www.lazada.vn/products/bo-dong-ho-thong-minh-dz09-tang-viet-cam-ung-i136090099-s138253249.html?search=1,Bộ đồng hồ thông minh DZ09 tặng viết cảm ứng,6
https://www.lazada.vn/products/dong-ho-thong-minh-x86-ket-noi-wifi-3g-pin-khung-600mah-i222290245-s279850035.html?search=1,"Đồng hồ thông minh X86 – Kết nối Wifi, 3G pin khủng 600Mah",7
https://www.lazada.vn/products/dong-ho-thong-minh-smartwatch-m9-den-i136913389-s139417835.html?search=1,Đồng hồ thông minh SmartWatch M9 (Đen),8
https://www.lazada.vn/products/dong-ho-thong-minh-c3-plus-doi-2017-tang-but-cam-ung-i137662539-s140405422.html?search=1,Đồng hồ thông minh C3 plus đời 2017 tặng bút cảm ứng,9
https://www.lazada.vn/products/dong-ho-thong-minh-dz09-vang-va-viet-cam-ung-i136268374-s138500902.html?search=1,Đồng hồ thông minh DZ09 (Vàng) và Viết cảm ứng,10
https://www.lazada.vn/products/dong-ho-thong-minh-va-dinh-vi-tre-em-q50-hang-nhap-khau-i237981345-s303660683.html?search=1,Đồng hồ thông minh và định vị trẻ em Q50 - Hàng nhập khẩu,11
https://www.lazada.vn/products/dong-ho-thong-minh-v8-bluetooth-man-hinh-tron-122-inch-ho-tro-the-sim-co-camera-dong-ho-thong-minh-smartwatch-cho-dien-thoai-thong-minh-i265146006-s381252041.html?search=1,Đồng Hồ Thông Minh V8 Bluetooth Màn Hình Tròn 1.22 inch,12
https://www.lazada.vn/products/dong-ho-thong-minh-inwatch-black-doi-2017-tang-but-cam-ung-den-i101096247-s101265098.html?search=1,Đồng hồ thông minh InWatch Black đời 2017,13
https://www.lazada.vn/products/dong-ho-thong-minh-smartwatch-gia-re-dz09-bac8-i247686945-s322411380.html?search=1,Đồng hồ thông minh SMARTWATCH giá rẻ DZ09 - BẠC.8,14
https://www.lazada.vn/products/dong-ho-thong-minh-smartwatch-dmt08-i102180246-s102617837.html?search=1,Đồng Hồ Thông Minh SmartWatch DMT08,15
https://www.lazada.vn/products/dong-ho-thong-minh-smart-watch-x6-man-hinh-cong-cao-cap-ban-quoc-te-dong-ho-thong-minh-chong-nuoc-dong-ho-thong-minh-tre-em-dong-ho-thong-minh-co-wifi-dong-ho-thong-minh-gia-re-vong-tay-thong-minh-the-gioi-dong-ho-i265218356-s381436451.html?search=1,Đồng hồ thông minh Smart Watch X6 Màn Hình Cong,16
https://www.lazada.vn/products/dong-ho-thong-minh-da-mau-sac-smartwatch-sa01-i143185283-s147956209.html?search=1,Đồng hồ thông minh đa màu sắc Smartwatch SA01,17
https://www.lazada.vn/products/dong-ho-thong-minh-dien-thoai-2017-hong-tang-kem-but-cam-ung-i136161470-s138344787.html?search=1,Đồng hồ thông minh điện thoại 2017 (Hồng),18
https://www.lazada.vn/products/dong-ho-thong-minh-smart-watch-x6-man-hinh-cong-cao-cap-tieng-viet-dong-ho-thong-minh-chong-nuoc-dong-ho-thong-minh-tre-em-dong-ho-thong-minh-co-bluetooth-dong-ho-thong-minh-gia-re-vong-tay-thong-minh-i253561809-s341132573.html?search=1,Đồng hồ thông minh Smart Watch X6 Màn Hình Cong Cao cấp Tiếng Việt,19
https://www.lazada.vn/products/moc-khoa-dong-ho-dien-tu-den-led-hien-gio-va-ngay-thang-chieu-tuong-hoac-tran-nha-vat-dung-di-kem-voi-chum-chia-khoa-i248756103-s326348864.html?search=1,Móc Khoá Đồng Hồ Điện Tử Đèn Led Hiện Giờ,20
https://www.lazada.vn/products/dong-ho-thong-minh-q9-co-wifi3g-ho-tro-khe-cam-the-nho-tfcard-i258425177-s358404882.html?search=1,Đồng hồ thông minh Q9 có Wifi/3G – Hỗ trợ khe cắm thẻ nhớ TFcard,21
https://www.lazada.vn/products/chuan-nhap-vong-deo-tay-thong-minh-smart-band-m3-do-nhip-tim-ket-noi-bluetoothdong-ho-thong-minh-chong-nuoc-vong-tay-dong-ho-day-deo-tay-tap-the-thao-vong-theo-doi-suc-khoe-vong-theo-doi-van-dong-chong-tham-nuoc-ipx5-i252903562-s337745956.html?search=1,Vòng đeo tay thông minh Smart Band M3,22
https://www.lazada.vn/products/dong-ho-nam-skmei-9069-co-lich-ngay-chong-nuoc-30m-day-thep-khong-gi-cao-cap-i223595034-s306118767.html?search=1,Đồng hồ nam Skmei 9069 có lịch ngày chống nước 30m dây thép không gỉ cao cấp,23
https://www.lazada.vn/products/dong-ho-thoi-trang-nam-dong-ho-chong-xuoc-dong-ho-doc-dao-day-da-chong-nuoc-dong-ho-quartz-sieu-tiet-kiem-pin-dong-ho-nam-dong-ho-gia-re-dong-ho-qbin-shop-i250251182-s330346522.html?search=1,Đồng hồ thời trang nam Quartz siêu tiết kiệm pin,24
https://www.lazada.vn/products/dong-ho-nam-dizizid-chong-nuoc-mat-sieu-mong-original-design-day-thep-lua-cao-cap-dz01-i251496675-s333522039.html?search=1,Đồng hồ nam DIZIZID chống nước mặt siêu mỏng Original Design dây thép lụa cao cấp DZ01,25
https://www.lazada.vn/products/dong-ho-nam-halei-day-vang-mat-denchong-nuoc-chong-xuoc-tuyet-doi-i248472294-s325140428.html?search=1,"đồng hồ nam halei dây vàng mặt đen,chống nước ,chống xước tuyệt đối",26
https://www.lazada.vn/products/dong-ho-nam-thoi-trang-cao-cap-chong-nuoc-l121-day-thep-khong-gi-co-video-co-2-mau-dong-ho-nam-cao-cap-i218057866-s394404103.html?search=1,Đồng Hồ Nam Thời Trang Cao Cấp Chống Nước L121 Dây Thép Không Gỉ,27
https://www.lazada.vn/products/xa-kho-3-ngay-dong-ho-nam-dong-ho-day-thep-khong-gi-dong-ho-sang-trong-dong-ho-thoi-trang-nam-chong-xuoc-chong-nuoc-cao-cap-co-6-kim-lich-thep-khong-gi-qbin-shop-i250263098-s330321825.html?search=1,"Đồng hồ nam chống nước cao cấp có 6 kim , lịch , thép không gỉ QBIN Shop",28
https://www.lazada.vn/products/dong-ho-nam-thoi-trang-chong-nuoc-skmei-9069-vang-sk-002-i143153931-s147931227.html?search=1,Đồng Hồ Nam Thời Trang Chống Nước Skmei 9069 ( Vàng) SK 002,
https://www.lazada.vn/products/dong-ho-nam-panars-usa-kieu-dang-quan-doi-cuc-chat-chong-nuoc-thoai-mai-i242913553-s310962178.html?search=1,"Đồng Hồ Nam PANARS USA Kiểu Dáng Quân Đội Cực Chất, Chống Nước Thoải Mái",30
https://www.lazada.vn/products/sieu-sale-tang-1-day-da-cao-cap-2-pin-ag4-tri-gia-100000d-khi-mua-dong-ho-nam-0mega-075-day-da-chong-xuoc-chong-nuoc-i258913975-s359962730.html?search=1,"Đồng Hồ Nam 0MEGA 075 Dây Da Chống Xước, Chống Nước",31
https://www.lazada.vn/products/dong-ho-nam-halei-day-vang-mat-trangchong-nuocchong-xuoc-i248453257-s325136070.html?search=1,"Đồng hồ nam Halei dây vàng mặt trắng,chống nước,chống xước.",32
https://www.lazada.vn/products/dong-ho-nam-chong-nuoc-dizizid-mat-sieu-mong-day-thep-lua-den-co-lich-ngay-tang-vong-ty-huu-may-man-i252535771-s418692262.html?search=1,Đồng hồ nam chống nước DIZIZID mặt siêu mỏng dây thép lụa đen có lịch,33
https://www.lazada.vn/products/dong-ho-nam-chong-nuoc-mat-sieu-mong-dizizid-day-titanium-co-kem-lich-ngay-cao-cap-dz3n01-tang-vong-ty-huu-thach-anh-den-i164785114-s423174964.html?search=1,Đồng hồ nam mặt siêu mỏng DIZIZID dây Titanium có kèm lịch ngày cao cấp DZ3N01,34
https://www.lazada.vn/products/sieu-khuyen-mai-tang-pin-du-tru-dong-ho-nam-halei-2v-vang-chong-nuoc-chong-xuoc-i190140111-s268203908.html?search=1,"Đồng hồ nam halei 2V vàng chống nước, chống xước",35
https://www.lazada.vn/products/dong-ho-nam-day-da-cao-cap-kashidun-chong-nuoc-30m-i244130326-s312725845.html?search=1,"Đồng Hồ Nam Dây Da Cao Cấp KASHIDUN, Chống Nước 30m",36
https://www.lazada.vn/products/dong-ho-nam-nibosi-2302-kinh-trang-sapphire-chong-nuoc-cuc-tot-chay-full-kim-i247080384-s377782259.html?search=1,Đồng hồ Nam NIBOSI 2302 Kính Tráng SAPPHIRE - Chống nước cực tốt – Chạy Full Kim,
https://www.lazada.vn/products/sieu-giam-giatang-hop-dep-va-pin-3-nam-tri-gia-50k-dong-ho-nam-thoi-trang-vang-sang-trong-cao-cap-kinh-sapphire-day-thep-kim-loai-chong-xuoc-chong-nuoc-chinh-rosra-i170029909-s257915184.html?search=1,Đồng hồ nam cao cấp kính sapphire dây thép kim loại chống xước chống nước,38
https://www.lazada.vn/products/dong-ho-nam-dizizid-dhcn03-chong-nuoc-original-design-day-thep-lua-thoi-trang-cao-cap-mau-moi-nhat-tang-vong-ty-huu-may-man-i253265767-s339036985.html?search=1,Đồng hồ nam DIZIZID DHCN03 chống nước Original Design dây thép lụa thời trang cao cấp,39
https://www.lazada.vn/products/dong-ho-nam-thoi-trang-chong-nuoc-skmei-den-sk-01-i106919800-s108241548.html?search=1,Đồng hồ nam thời trang chống nước Skmei ( Đen ) SK 01,
https://www.lazada.vn/products/dong-ho-nam-nibosi-2309t-1985-day-thep-duc-cao-cap-chay-6-kim-sieu-chong-nuoc-va-chong-xuoc-full-box-i218192599-s273676900.html?search=1,ĐỒNG HỒ NAM NIBOSI 2309T (1985) DÂY THÉP ĐÚC CAO CẤP CHẠY 6 KIM,
https://www.lazada.vn/products/dong-ho-nam-thoi-trang-chong-nuoc-skmei-den-01-i105939984-s107071860.html?search=1,Đồng hồ nam thời trang chống nước Skmei ( Đen ) 01,
https://www.lazada.vn/products/cap-dong-ho-halei-nam-nu-cao-cap-chong-xuoc-chong-nuoc-tuyet-doi-gia-1-doi-day-vang-mat-den-i200031478-s250034814.html?search=1,"Cặp Đồng hồ Halei nam nữ cao cấp chống xước, chống nước tuyệt đối (Giá 1 đôi)",43
https://www.lazada.vn/products/khuyen-mai-khung-tang-vong-da-ty-huu-2-pin-ag4-tri-gia-100000d-khi-mua-dong-ho-nam-r0lex-r028-day-da-chong-xuoc-chong-nuoc-i249487939-s362982125.html?search=1,"Đồng Hồ Nam R0LEX R028 Dây Da Chống Xước, Chống Nước",44
https://www.lazada.vn/products/dong-ho-nam-thoi-trang-chong-nuoc-skmei-9069-trang-01-i143056125-s147796024.html?search=1,Đồng Hồ Nam Thời Trang Chống Nước SKMEI 9069 ( Trắng ) 01,
https://www.lazada.vn/products/dong-ho-nam-the-thao-mingzhi-nhat-ban-chong-nuoc-sieu-tot-2-may-ben-bi-manh-me-i258925266-s359815658.html?search=1,Đồng hồ Nam Thể Thao MINGZHI Nhật Bản Chống Nước Siêu Tốt - 2 Máy Bền bỉ & Mạnh mẽ,46
https://www.lazada.vn/products/dong-ho-nam-army-usa-quan-doi-my-vien-benzen-kim-loai-sieu-ben-i258843345-s359624994.html?search=1,Đồng hồ Nam ARMY USA Quân Đội Mỹ - Viền Benzen kim Loại siêu bền,47
https://www.lazada.vn/products/dong-ho-nam-casio-g-shock-ga-110gb-52mm-i264308876-s378672962.html?search=1,Đồng Hồ Nam Casio G - Shock GA 110GB 52mm,48
https://www.lazada.vn/products/dong-ho-thoi-trang-nam-thoi-trang-dong-ho-sanda-i264088157-s378144597.html?search=1,Đồng Hồ Thời Trang Nam Thời Trang - Đồng Hồ SANDA,
https://www.lazada.vn/products/dong-ho-nam-rong-fngeen-3d-day-thep-khong-gi-ban-doanh-nhan-tang-vong-ty-huu-fullbox-i244236800-s312882009.html?search=1,ĐỒNG HỒ NAM RỒNG FNGEEN 3D DÂY THÉP KHÔNG GỈ BẢN DOANH NHÂN,50
https://www.lazada.vn/products/khuyen-mai-lon-giam-gia-dac-biet-khi-mua-dong-ho-nam-r0lex_jjk99-duoc-tang-vong-da-ty-huu-phong-thuy-tri-gia-150k-02-pin-du-tru-i254265855-s343831058.html?search=1,ĐỒNG HỒ NAM R0LEX_JJK99,51
https://www.lazada.vn/products/dong-ho-nam-day-kim-loai-casio-anh-khue-ae-1200whd-1avdf-tang-day-da-bo-cao-cap-va-tang-dong-ho-the-thao-qq-i102916639-s103568284.html?search=1,Đồng hồ nam dây kim loại Casio Anh Khuê AE-1200WHD-1AVDF,52
https://www.lazada.vn/products/dong-ho-nam-vicero-cao-cap-6-kim-chiu-nuoc-thoai-mai-5-mau-de-lua-chon-i235558877-s313440492.html?search=1,Đồng Hồ Nam VICERO Cao Cấp 6 Kim Chịu Nước Thoải Mái 5 Màu Để Lựa Chọn,53
https://www.lazada.vn/products/dong-ho-thong-minh-suc-khoe-nam-skmei-1227-smart-watch-pin-1-nam-ma-dha475-i135691919-s137765406.html?search=1,Đồng hồ Thông Minh Sức Khỏe Nam Skmei 1227 Smart Watch Pin 1 Năm,
https://www.lazada.vn/products/dong-ho-nam-day-kim-loai-casio-anh-khue-ae-1200whd-1avdf-tang-day-da-bo-cao-cap-i102916628-s103568268.html?search=1,Đồng hồ nam dây kim loại Casio Anh Khuê AE-1200WHD-1AVDF + Tặng dây da bò cao cấp,55
https://www.lazada.vn/products/dong-ho-nam-day-thep-lua-den-dizizid-mat-sieu-mong-original-design-dztv-tang-vong-ty-huu-thach-anh-den-i245731595-s315261480.html?search=1,Đồng hồ nam dây thép lụa đen DIZIZID mặt siêu mỏng Original Design DZTV,56
https://www.lazada.vn/products/tro-gia-3004-dong-ho-nam-sesop-chau-au-van-soc-dang-cap-tang-kem-pin-du-phong-i255653984-s348594331.html?search=1,Đồng hồ Nam SESOP Châu Âu - Vân Sọc Đẳng Cấp + Tặng kèm pin dự phòng,57
https://www.lazada.vn/products/dong-ho-nam-roma-italy-kinh-trang-sapphire-full-kim-day-thep-duc-dat-cao-cap-i266134495-s385152050.html?search=1,Đồng hồ Nam ROMA ITALY Kính Tráng Sapphire Full Kim – Dây thép đúc đặt cao cấp,
https://www.lazada.vn/products/dong-ho-nam-sieu-dep-ttp-217mat-trang-i145690628-s151614848.html?search=1,Đồng hồ nam siêu đẹp TTP-217(mặt trắng)),59
https://www.lazada.vn/products/dong-ho-nam-mat-original-sieu-mong-day-thep-lua-den-cao-cap-dizizid-dz01-tang-hop-xin-pin-du-phong-tri-gia-35k-i245730562-s315260439.html?search=1,Đồng hồ nam mặt Original siêu mỏng dây thép lụa đen cao cấp DIZIZID DZ01,60
https://www.lazada.vn/products/dong-ho-thong-minh-smart-watch-a1-hong-i244325083-s313026854.html?search=1,Đồng hồ thông minh Smart watch A1 (Hồng),62
https://www.lazada.vn/products/dong-ho-thong-minh-inwatch-c-plus-doi-2017-i101096283-s147342973.html?search=1,Đồng hồ thông minh InWatch C plus đời 2017,63
https://www.lazada.vn/products/dong-ho-thong-minh-x8-ket-noi-wifi3g-ho-tro-camera-kep-i222305035-s279864519.html?search=1,"Đồng hồ thông minh X8 kết nối Wifi,3G hỗ trợ camera kép",64
https://www.lazada.vn/products/dong-ho-thong-minh-smart-watch-a1-gan-sim-doc-lap-xanh-la-i2112428-s147350991.html?search=1,Đồng hồ thông minh Smart Watch A1 gắn sim độc lập (Xanh lá)  ,65
https://www.lazada.vn/products/dong-ho-thong-minh-smartwatch-dz09-chinh-hang-gia-re-i101892253-s102242383.html?search=1,Đồng hồ thông minh SmartWatch DZ09 chính hãng giá rẻ,66
https://www.lazada.vn/products/83-la-phu-nu-se-co-qua-tang-lac-tay-hoppin-dong-ho-thoi-trang-nu-cao-cap-day-kim-loai-chong-nuoc-thuong-hieu-dimini-i246377408-s348499216.html?search=1,Đồng hồ thời trang nữ cao cấp dây kim loại chống nước thương hiệu Dimini (blue),67
https://www.lazada.vn/products/tang-lac-ma-vang-non-tang-pin-tang-hop-dong-ho-thoi-trang-nu-cao-cap-day-kim-loai-chong-nuoc-thuong-hieu-dimini-i246059820-s315903506.html?search=1,Đồng hồ thời trang nữ cao cấp dây kim loại chống nước thương hiệu Dimini ( gold ),68
https://www.lazada.vn/products/hang-moi-ve-dong-ho-thoi-trang-nu-geneva-nhieu-mau-dong-ho-6-kim-dong-ho-thoi-trang-nam-dong-ho-thoi-trang-unisex-chong-nuoc-di-mua-rua-tay-dong-ho-qbin-shop-i228248695-s289549331.html?search=1,"Đồng hồ thời trang nữ Geneva , đồng hồ 6 kim",69
https://www.lazada.vn/products/dong-ho-nu-halei-hl236-v6-mat-trang-chong-nuoc-i143202820-s147979321.html?search=1,Đồng hồ nữ Halei Hl236 V6 mặt trắng chống nước,70
https://www.lazada.vn/products/dong-ho-nu-day-kim-loai-gia-re-chong-nuoc-bs-bee-sister-dinh-da-m020-kem-hop-new-luxury-dong-ho-nu-gia-re-chong-nuoc-day-kim-loai-tang-kem-pin-dong-ho-thay-the-mai-lee-i233627625-s297279973.html?search=1,Đồng hồ nữ Dây Kim Loại Giá rẻ Chống Nước BS Bee Sister Đính đá M020 (Kèm Hộp),71
https://www.lazada.vn/products/tang-lac-tang-pin-tang-hop-dong-ho-nu-thoi-trang-cao-cap-mobangtuo-day-nam-cham-chong-suoc-chong-nuoc-i248461588-s325220490.html?search=1,Đồng hồ nữ thời trang cao cấp Mobangtuo dây nam châm chống sước chống nước,72
https://www.lazada.vn/products/dong-ho-nu-halei-hl168-v6-mau-vang-chong-nuoc-i143199050-s147973245.html?search=1,Đồng hồ nữ Halei HL168 V6 màu vàng chống nước,73
https://www.lazada.vn/products/dong-ho-nu-day-thep-mau-vang-v6-001-chong-nuoc-halei-i143200004-s147972294.html?search=1,Đồng hồ nữ dây thép màu vàng V6 001 chống nước HALEI,74
https://www.lazada.vn/products/dong-ho-nu-curren-chong-nuoc-day-thep-lua-cao-cap-i236929774-s306156003.html?search=1,"Đồng Hồ Nữ CURREN Chống Nước, Dây Thép Lụa Cao Cấp",75
https://www.lazada.vn/products/sieu-gia-99k-dong-ho-nam-jenises-hien-thi-lich-ngay-cao-cap-i266604249-s420774383.html?search=1,(SIÊU GIÁ 99K) Đồng Hồ Nam JENISES - Hiển Thị Lịch Ngày Cao Cấp,76
https://www.lazada.vn/products/sieu-gia-3004-dong-ho-nam-roma-luxury-kinh-sapphire-day-charm-duc-dat-dang-cap-i255689378-s348659530.html?search=1,(Siêu giá 30.04) Đồng hồ Nam ROMA LUXURY Kính Sapphire – Dây CHARM đúc đặt đẳng cấp,
https://www.lazada.vn/products/dong-ho-nam-roma-italy-lux-kinh-trang-sapphire-full-kim-day-thep-duc-dat-cao-cap-i266134138-s384948111.html?search=1,Đồng hồ Nam ROMA ITALY LUX Kính Tráng Sapphire Full Kim – Dây thép đúc đặt cao cấp,
https://www.lazada.vn/products/dong-ho-nam-jun-yu-day-da-thoi-trang-den-i166128540-s181882629.html?search=1,Đồng hồ nam JUN YU dây da thời trang (Đen),79
https://www.lazada.vn/products/dong-ho-nam-nibosi-1985-day-da-tron-chay-6-kim-hang-full-box-i216963427-s291516235.html?search=1,"Đồng hồ nam NIBOSI 1985 dây da trơn chạy 6 kim, hàng full box",
https://www.lazada.vn/products/dong-ho-nam-nibosi-cao-cap-hang-fullbox-tang-pin-du-phong-va-cay-thao-mac-ni2309-day-duc-may-chay-6-kim-i216278409-s312603605.html?search=1,"Đồng hồ Nam Nibosi cao cấp (Ni2309 dây đúc, máy chạy 6 kim)",
https://www.lazada.vn/products/dong-ho-nam-sanda-the-thao-day-silicone-sieu-ben-i264056568-s390878128.html?search=1,Đồng Hồ Nam SANDA Thể Thao Dây Silicone Siêu Bền,
https://www.lazada.vn/products/dong-ho-nam-roma-italy-kinh-trang-sapphire-chuyen-mau-nghe-thuat-day-thep-duc-dat-cao-cap-i249605431-s393768032.html?search=1,Đồng hồ Nam ROMA ITALY Kính Tráng Sapphire,
https://www.lazada.vn/products/gia-goc-dong-ho-nam-nibosi-luxury-kinh-trang-sapphire-chong-nuoc-cuc-tot-chay-full-kim-i266170159-s385114349.html?search=1,Đồng hồ Nam NIBOSI LUXURY Kính Tráng SAPPHIRE,
https://www.lazada.vn/products/dong-ho-nam-nibosi-1985-day-thep-luoi-mong-cao-cap-full-6-kim-lich-ngay-full-box-i221417077-s279385872.html?search=1,Đồng hồ nam NIBOSI 1985 dây thép lưới mỏng cao cấp full 6 kim lịch ngày (full box),
https://www.lazada.vn/products/xa-hang-dong-ho-thoi-trang-nam-chong-xuoc-chong-nuoc-cao-cap-co-6-kim-lich-thep-khong-gi-qbin-shop-moi-nhat-2018-mau-bac-mat-xanh-mat-trang-i250060015-s329744917.html?search=1,"Đồng hồ thời trang nam 6 kim , lịch , thép không gỉ QBIN Shop mới nhất 2018",86
https://www.lazada.vn/products/dong-ho-thong-minh-gan-sim-sa01-tang-kem-1-but-cam-ung-i102636644-s103188852.html?search=1,Đồng hồ thông minh gắn sim SA01+ Tặng kèm 1 bút cảm ứng,87
https://www.lazada.vn/products/dong-ho-thong-minh-smartwatch-sa1-hong-tang-kem-the-nho-va-but-cam-ung-i143248794-s148053157.html?search=1,Đồng hồ thông minh SMARTWATCH SA1 (Hồng),88
https://www.lazada.vn/products/dong-ho-thong-minh-a1-gia-re-i102025150-s102407292.html?search=1,Đồng hồ thông minh A1 giá rẻ,89
https://www.lazada.vn/products/sale-50-vong-deo-tay-thong-minh-smart-band-m3-do-nhip-tim-ket-noi-bluetoothdong-ho-thong-minh-chong-nuoc-vong-tay-dong-ho-day-deo-tay-tap-the-thao-vong-theo-doi-suc-khoe-vong-theo-doi-van-dong-i258174545-s357925437.html?search=1,Vòng đeo tay thông minh Smart Band M3 Đo Nhịp Tim kết nối Bluetooth ( green ),90
https://www.lazada.vn/products/dong-ho-thong-minh-dz09-the-he-moi-nghe-goi-nhan-tin-thong-bao-cuoc-goi-dam-thoai-tu-dien-thoai-i246314923-s316368658.html?search=1,Đồng Hồ Thông Minh Dz09 Thế Hệ Mới,91
https://www.lazada.vn/products/vong-deo-tay-thong-minh-m2-do-nhip-tim-ket-noi-bluetoothdong-ho-thong-minh-chong-nuoc-vong-tay-dong-ho-day-deo-tay-tap-the-thao-vong-theo-doi-suc-khoe-vong-theo-doi-van-dong-i257957167-s357305441.html?search=1,Vòng đeo tay thông minh M2 Đo Nhịp Tim kết nối Bluetooth,92
https://www.lazada.vn/products/miband-3-dong-ho-thong-minh-phien-ban-tieng-viet-i244051943-s312637726.html?search=1,MIBAND 3 ĐỒNG HỒ THÔNG MINH - PHIÊN BẢN TIẾNG VIỆT,93
https://www.lazada.vn/products/dong-ho-thong-minh-chong-nuoc-quan-ly-va-dinh-vi-tre-em-df25-hang-nhap-khau-i253308258-s338685056.html?search=1,Đồng hồ Thông minh Chống nước quản lý và định vị trẻ em DF25 - Hàng nhập khẩu,94
https://www.lazada.vn/products/dong-ho-thong-minh-smart-watch-dz09-i133366721-s134391345.html?search=1,Đồng hồ thông minh Smart watch DZ09,95
https://www.lazada.vn/products/dong-ho-thong-minh-smart-watch-uwatch-dz09-vang-i223602661-s281820613.html?search=1,Đồng Hồ thông minh Smart Watch Uwatch DZ09 (Vàng),96
https://www.lazada.vn/products/free-gift-dong-ho-thong-minh-sx6-man-hinh-cong-trang-tang-kem-mat-kieng-tai-nghe-i235346067-s299829414.html?search=1,Đồng hồ thông minh SX6 màn hình cong (Trắng),97
https://www.lazada.vn/products/dong-ho-thong-minh-smart-watch-sa1-mau-trang-white-i247032560-s319325737.html?search=1,Đồng hồ thông minh SMART WATCH SA1 - màu trắng,98
https://www.lazada.vn/products/dong-ho-thong-minh-smart-watch-dz09-den-i107063383-s108399335.html?search=1,Đồng hồ thông minh Smart Watch DZ09 Đen,99
https://www.lazada.vn/products/dong-ho-dien-thoai-smartwatch-dz09-den-i136913388-s139417834.html?search=1,Đồng hồ điện thoại SmartWatch DZ09 (Đen),100
https://www.lazada.vn/products/dong-ho-thong-minh-v8-nghe-goi-nhan-tin-2-chieu-nghe-nhac-chup-hinh-co-tieng-viet-i242767685-s310643599.html?search=1,"Đồng hồ thông minh V8 - Nghe gọi nhắn tin 2 chiều, Nghe nhạc, Chụp hình",102
https://www.lazada.vn/products/dong-ho-thong-minh-smartwatch-putoca-xy08-pro-gan-sim-doc-lap-tang-tai-nghe-bluetooth-i105856038-s106982523.html?search=1,Đồng hồ thông minh Smartwatch PUTOCA XY08 Pro,103
https://www.lazada.vn/products/dong-ho-nam-day-vai-pgh02-xanh-phoi-do-i213683755-s267652851.html?search=1,Đồng hồ nam dây vải PGH02 (Xanh phối đỏ),104
https://www.lazada.vn/products/dong-ho-nam-day-da-kinh-3d-i100027261-s297492909.html?search=1,Đồng hồ nam dây da kính 3D,105
https://www.lazada.vn/products/dong-ho-nam-aernsi-day-titanium-2-lich-cao-cap-i249279465-s391486110.html?search=1,Đồng Hồ Nam AERNSI Dây Titanium - 2 Lịch Cao Cấp,106
https://www.lazada.vn/products/dong-ho-nam-day-thep-cao-cap-mat-rong-vang-fullbox-du-mau-tang-kem-vong-ty-huu-cao-cap-i256045030-s349775254.html?search=1,Đồng hồ nam dây thép cao cấp Mặt Rồng Vàng Fullbox,107
https://www.lazada.vn/products/tang-kem-pin-dong-ho-nam-mat-sieu-mong-dizizid-day-titanium-co-lich-ngay-cao-cap-dz3n01-day-den-mat-den-i260071534-s364149810.html?search=1,Đồng hồ nam mặt siêu mỏng DIZIZID dây Titanium DZ3N01,108
https://www.lazada.vn/products/dong-ho-nam-dong-ho-nibosi-2309-vong-ty-huu-phong-thuy-i252036679-s334735406.html?search=1,"Đồng hồ nam, đồng hồ nibosi 2309 + Vòng tỳ hưu phong thủy",
https://www.lazada.vn/products/dong-ho-nam-nibosi-1985-day-duc-thep-khong-gi-ni2309-day-duc-i209081827-s277202137.html?search=1,"Đồng hồ nam Nibosi 1985 dây đúc, thép không gỉ (Ni2309 dây đúc )",
https://www.lazada.vn/products/dong-ho-nam-day-thep-dac-dinh-hat-cao-cap-nibosi-2315-fullbox-i200014086-s250013393.html?search=1,Đồng hồ nam dây thép đặc đính hạt cao cấp Nibosi 2315 (fullbox),
https://www.lazada.vn/products/dong-ho-nam-dong-ho-nibosi-2309-vang-mat-den-vong-tay-ty-huu-phong-thuy-i248213777-s324226785.html?search=1,"Đồng hồ nam, đồng hồ Nibosi 2309 vàng mặt đen",
https://www.lazada.vn/products/tang-pin-du-phong-them-vong-ty-huu-dong-ho-nam-nibosi-1985-day-lua-dong-ho-nam-dong-ho-nibosi-1985-dong-ho-nibosi-day-lua-dong-ho-nibosi-day-lua-1985-dong-ho-thoi-trang-nam-nibosi-dong-ho-nibosi-thoi-trang-cap-cap-i248754459-s326683758.html?search=1,Đồng Hồ Nam Nibosi 1985 Dây Lụa- Đồng Hồ Nibosi Thời Trang Cao Cấp,
https://www.lazada.vn/products/dong-ho-nam-sesop-ryker-dinh-da-sang-trong-tang-pin-du-phong-i255618566-s348440759.html?search=1,Đồng hồ Nam SESOP RYKER Đính đá sang trọng,114
https://www.lazada.vn/products/dong-ho-nam-nibosi-1985-day-duc-thep-khong-gi-nibosi-717-day-duc-i232006970-s294695146.html?search=1,"Đồng hồ nam Nibosi 1985 dây đúc, thép không gỉ (NIbosi 717 dây đúc )",
https://www.lazada.vn/products/dong-ho-nam-nibosi-1985-day-da-cao-cap-tang-kem-pin-vong-ty-huu-i211757349-s277680287.html?search=1,Đồng hồ nam NIBOSI 1985 dây da cao cấp,
https://www.lazada.vn/products/dong-ho-nam-nibosi-1985-day-thep-duc-chay-6-kim-business-style-mdl-2309s-fullbox-kem-pin-i208479534-s279377228.html?search=1,Đồng hồ nam NIBOSI 1985 dây thép đúc chạy 6 kim business MDL-2309S,
https://www.lazada.vn/products/dong-ho-day-da-nam-thoi-trang-697-i228315509-s289622861.html?search=1,Đồng hồ dây da nam thời trang 697,118
https://www.lazada.vn/products/dong-ho-nam-orlando-day-thep-co-clip-i250227569-s330519356.html?search=1,Đồng hồ nam ORLANDO dây thép có clip,119
