,Comment
4926,e bt lam roi do la bai tap ve nha cua em hoi ki 1
4927,10:16 ngta tiêm thuốc á chị
4928,Cj trồng giá cho bò ăn hả
4929,Cai nay trong lop em lam roi
4930,Trồng 6 ngày vẫn ăn được mà
4931,Em chào chị thơ 👋👋👋👋
4932,"Chỗ em không mưa luôn nè,hihi,ko bt chỗ cj có mưa ko"
4933,Hay quá chị ơi .nhà em có trồng giá nè chị
4934,Hay qua chi thơ ơi
4935,Con chó thơ Nguyễn
4936,Bình thường tui trồng quài
4937,I ❤ Thơ Nguyễn
4938,Em học khoa học em làm rồi
4939,"Năm ngoái em với tụi bạn có trồng thử giá đỗ và 😁 nó lên rất tốt nhưng ba mẹ e ăn ko trừa cây nào 😆
Ba mẹ e nói ngon thấy có lỗi với tụi bạn 😃😅😂 mà giờ cũng bớt thân lại rồi :(
Câu chuyện xàm xí đú nhúng rất thích kể"
4940,Chi lam thu thach 24gio lam me
4941,"Team xem trễ 
👇👇👇"
4942,em chào  chị  ạ
4943,huhu sắp thi cuối học kỳ hai rồi
4944,Nhà em học sinh học trồng cái này
4945,Nhà e có đồ làm giá cách cũng tương tự như cách chị hướng dẫn
4946,Chi oi gia dep qua chi a chi that gioi qua😍😍😍😍😍😍😍😍😍😍
4947,Chi co video thi bao em
4948,phút cuối nhìn mắc phê..
4949,anh chi thi trong gia di
4950,"ai muốn anh TBB cover BẠC PHẬN, điểm danh"
4951,Chi oi em ko an duoc gia mà sao chi an nhìn ngon the ???
4952,giá là j vậy chị
4953,"Chuc cac co mot ki thi tot dep
😀😀😀😀😀😀🤗🤗🤗😁😁😁😊😊😊😊😊😊😊😊😄😄😄😄"
4954,Chi trong cay dau xanh luon di
4955,Em làm dược rồi
4956,em thấy giá của chị bổ dưỡng hơn là giá chị tự mua tại gì giá chị tự trồng chị chỉ tưới nước còn giá của chị mua thò người ta trồng đâu chỉ  tưới nước không đâu mà còn phun thuốc trừ sâu và còn nhiều loại thuốc nữa đó. nên trước khi chị ăn chị phải rửa thiệt là sạch mới được ăn để không đau bụng đấy các bạn khác cũng vây nha
4957,Em cảm on chị nhé.😁
4958,I love you Thơ Nguyễn
4959,em thấy dạo này cj có vẻ hơi mập lên
4960,Mình chúc các bạn thành viên kênh Thơ Nguyễn thi được điểm cao nha😊😊
4961,Emse thu trông giá côi sao không biêt em có trông đuoc không nua
4962,Ai chưa thực hành thì điểm danh
4963,Nhìn chị thơ làm mà mê
4964,Chi oi chi lam líp ve lam slime di
4965,Giá mập có thuốc
4966,Sao chị lm nhiều z e chỉ cần lấy đất lắp lên Đậu r tưới nc Hằng ngày vài bữa sau nó mọc lên cây giá r
4967,Chị oi ngam tới 3h den 4h thôi
4968,Em đalam thi nghiem nay trong môn sinh hoc đay chi tho oi ai đa lam điem danh
4969,Team xem trễ 6 phút
4970,Mình sẽ chồng thử hihi
4971,luc dau sao chi xoa video
4972,Xin chào Chi 😃😃😃
4973,Ai để y khúc đau anh tbb mac do mau xanh duong đang quay phim hk:<
4974,Chị phải d
4975,Bà tào lao quá bà ôi mội người unsub bà này nhe
4976,hay quá chị ơi
4977,hay quá chị ơi
4978,❤❤
4979,E sắp thi r chị ơi
4980,Nhà em cũng làm giá như chị
4981,Lại xem trễ rồi huhu 😢
4982,Chị ơi làm video về 2 bé cún di
4983,Kính nể😅😅😅😅😅
4984,Giá  CHI  làm  ngon muôn  ăn  quá 😋😋😋😋😋😋❤❤❤💓💓💓chị  Thơ  Nguyễn  vẫn là  nhất 👍👍❤❤❤❤
4985,Chị Thơ giỏi quá
4986,Hay quá chị ơi
4987,Bông gòn nữa chị
4988,Chị làm hay thật
4989,Chi thơ khéo tay quá
4990,"Có ai thi xong chưa vậy ,????????"
4991,Cảm ơn chị
4992,Em xem muộn rồi .
4993,Trông hôm nay nhìn chị Thơ đẹp ra và trẻ ra trông dễ thương làm sao 😊😊😊😊😊 ( mong cj thích ) mãi yêu chị Thơ
4994,"chào mn 😂
chức mn thi tốt 😊"
4995,"Chị Thơ ơi sao kì vậy chị lúc nãy khoảng 15 phút trước có một video giống như vậy nhưng mà nó đã bị ai xóa, em chưa kịp xem."
4996,Chị like cho coment của em nha
4997,Số tóc của chị thơ nguyễn dựa vào đây 👇👇👇👇👇👇👇👇👇👇👇👇👇👇👇👇👇👇👇
4998,Xem sớm =))
4999,Like thứ 141😭😭😭😅
5000,0 lượt xem 256 like wow😱
5001,có ai vừa mới mở lên đều like như mình hk=))
5002,Hi chị Thơ Nguyễn
5003,Sao mờ vậy chị???
5004,nhìn kĩ chị giống con momo quá
5005,Hí-lô-chị
5006,Làm bằng trấu.. Lúa...
5007,Nhà Chị o dau
5008,Dừng châu chấu đó chị
5009,ae vào xem bé kien tv ( kha banh) nha troll cực hay
5010,Em sẽ thử làm
5011,Chi thu trong bap cai di chi tho
5012,Cái này sinh lớp 6 có học mà cj
5013,Chị thơ ơi chị hướng dẫn trồng dâu Tây được ko ạ ?🍓🍓🍓🍓🍓🍓🍓
5014,Cuối cùng em cx là người xem video của chị đâu tiên 😋😜❤
5015,Tô sứ của chị thơ giống tô nhà em...hehe
5016,chị ơi những cái bình hạt nở slime đâu chị
5017,Giá đỗ của chị làm tươi quá! Em rất thích ăn giá🤗
5018,Chị thơ trồng giá do giỏi thật cho chị một like👍
5019,Sao video bị xoá vậy chị
5020,Ai thích video của chị Thơ Nguyễn like
5021,Em học lớp 5 em đã thí nghiệm rồi à
5022,Chị that là cham chỉ làm viec do😆
5023,cái này hồi đó cô em bảo làm thực hành
5024,"Chúc các bạn được điểm 10 trong học kì 2
😚😚😚😚😚😚😚😚😚😚❤❤❤❤❤❤🎈"
5025,0 lượt xem 354 like
5026,Team xem sớm điểm danh
5027,hay quá chị ơi!
5028,Sao kon coi đc chị ơi
5029,Em cũng trồng đậu rồi
5030,Chi tho bon mat
5031,Sắp thi rồi ! 😭😭😭
5032,😍😍😍😍😍😍😍😍
5033,Lần đầu tiên em sớm mong được chị Thơ thả tim😍😍
5034,Like và comment đầu tiên nek cj có đc rep ko yêu cj😘
5035,hình như chị xoá rồi đăng lại chăng
5036,"Lúc đầu nó mộc lên em tưởng là c9n sâu . Sợ chết , khi nhìn kĩ thì mới biết là cái gì"
5037,Coment đầu nè chị😋
5038,chào chị hai của team Thơ Nguyễn hihi❤
5039,"0 lượt xem,384 like"
5040,Chao chi video cua chi rat hay ai thay dung like nhe👍👍👍👍👍👍👍👍👍👍👍
5041,Em chi can nua ngay la lam duoc
5042,Chi ơi tai sao chi luc nay chi xoa
5043,Muộn hơn 2000 người :)
5044,Lần đầu xem sớm
5045,Chị ơi người ta tiêm thuốc kích thích tăng trưởng cho giá nên nó mới mập và không đắng đó
5046,Em like thứ 652
5047,Chi tho nguyen thu an oc ngon tay di
5048,"Taem nào chuẩn bị thi học kì 2...............





CHÚC MẤY BỢN THI TỐT NHOA😙😙😙moa moa💋🤘"
5049,Chi oi em lam ma ko duoc
5050,Sao anh ko trool thơ nữa
5051,cj thơ giỏi quá
5052,cj thơ giỏi quá
5053,Chị trồng khéo tay quá 😊
5054,"0 lượt xem, 249like ,23binhf luận 🤔"
5055,Ai yêu  thơ Cho 10000👍👍👍👍👍👍👍💗💗💘💖💝💞👇
5056,"Chị ơi,chị có việc gì mà phải chỉnh sửa video sau khi đăng xong vậy ạ?"
5057,"Chào chị, em bình luận đầu tiên nà"
5058,E là người like và bình luận trước nè mong chị tim cho em
5059,0 luot xem ma 311 nguoi lai ky la that
5060,hồi nãy chị mới đăng xong hình như chị lại gỡ xuống đúng ko? E nhận đc thông báo những nó ko xem đc!
5061,Em xem đầu nè.Mong chị thả tim cho em
5062,Em xem đầu chị Thơ ơi
5063,E cũng trồng giá rồi chị ạ
5064,Chị Thơ siêng quá
5065,Mong được chị 👍
5066,Iu chị thơ wá 😍😍
5067,dang coi mot bo phim tu nhien thay kenh cua chi tho nguyen thi vo xem lien con cai kenh do thi ke hihi
5068,I love thơ nguyễn
5069,I love thơ nguyễn
5070,Yêu cj Thơ
5071,bông gòn củng đc mà chị?
5072,Nhung em làm bằng bông y tế cơ
5073,"Lúc đầu video bị xóa hả chị, bây giờ nó báo lại rồi"
5074,Like dau
5075,Chị ơi sao vừa lẫy chị đăng clip sao em không vào xem được
5076,Xem sớm có được tim không chị ❤❤❤❤
5077,Ai xem sớm cho mình một like
5078,Lần đầu tiên được xem sớm như vậy!
5079,"Em chào chị thơ ngáo ngơ, em chưa bao giờ dc chị thả ♥"
5080,Lúc nãy video đó bị sao vậy
5081,Team xem sớm điểm danh
5082,Chị dễ thương quá àk
5083,Em là người xem đầu tiên nè
5084,xem đầu luôn nè
5085,Em trồng đậu đen nè chị thơ
5086,0 lượt xem mà 67 like
5087,Chị xinh gái quá yêu chị
5088,Team xem đầu😁😁
5089,Đoạn video đầu như cái con gì ghê quá thì ra là cây đậu xanh trong quá trình phát triển
5090,Giá đỗ là gì vậy chị
5091,Team xem sớm hiện hình
5092,Chào chị thơ😘😘😘
5093,"em la nguoi xem dau tien ne.
mong chi tha tim"
5094,"Chị trồng hay quá
YÊU CHỊ THƠ NGUYỄN"
5095,hello chi
5096,Hello cj
5097,Em chào chị mong chị thích bình luận của em love thơ nguyễn
5098,"hello chị thơ ,bạn nào muốn chị thơ làm thử thách 24 h"
5099,Woh chị trồng thật giỏi
5100,Ôi lo ngơ mình là ngươi đầu tiên
5101,Xem đầu🌷🌷🌷🌷🌷
5102,Yêu Chị 😍😍😍
5103,Ai xem sớm điểm danh
5104,em xem thứ 1 nhé
5105,xem đầu l
5106,Chị Thơ giỏi quá
5107,Wow 0 lượt xem 220 lượt like
5108,Chị  không nấu à
5109,Chị giỏi quá
5110,"um , sao hom nay hap tap vay!?"
5111,SHOP CHỊ THƠ NGUYỄN Ở ĐÂU VẬY
5112,đỗ đen có đc k vậy mn
5113,"trời sao mấy thím nhanh vậy vô nhanh mà ko kịp
yêu chị thơ"
5114,Xem sớm điểm danh ik mí bn 😆❤️
5115,Lúc nãy chị đăng mà sao dô xem k đc đợi tới giờ mới thấy luôn á
5116,hello chị thơ sao nãy chị xóa video thế ạ?
5117,em xem đầu nè  chị moa moa
5118,team xem sớm đâu rồi nè
5119,Tui xem dau
5120,Quá toẹt vời! Quá ngon nuôn ❤️❤️❤️
5121,Xem truoc tha tym cho e nha.0
5122,em thi nop sinh hoc
5123,em thach chi di boi ngoai mua
5124,❤
5125,Xem đầu
5126,Buồn wa xem hơi muộn
5127,Cái nay ai 2k7 . Môn sinh học học rôi
5128,He này em sẽ làm
5129,0 lượt xem mà 234 lượt like
5130,Yêu chị Thơ
5131,Yêu chị Thơ
5132,"hihi, chị thơ hài hước quá"
5133,Em xem đầu chị Thơ ơi ❤️❤️❤️❤️❤️
5134,Mình là người xem sớm nhất
5135,Xem đầu like đầu comment đầu luôn nè chị
5136,Ko biết ai xem thứ hai 🧐🧐
5137,Em xem đầu chi thơ ơi
5138,Xem đầu lun chị thơ iu ơi
5139,Cmt đầu ạ 😊
5140,Em xem đầu tiên
5141,À nhon xe o.😘😘
5142,Xem đầu điểm danh
5143,Xem đầu nè cj
5144,Em xem dau ne chi tho
5145,Cuối cùng cũng vô xớm
5146,Em chào chị Thơ
5147,Xem đầu
5148,Team xem xớm
5149,E yêu chị Thơ
5150,Chi lam that roi
5151,En cũng biết làm
5152,E xem sớm nè chị
5153,First view
5154,Hi chào chị ạ😘😘😘😘
5155,Thấy đăng vô xem liền nek😍😍😍
5156,Like đầu cho chj thơ iu nề hihi
5157,Xem đầu + cmt đầu
5158,Em cũng làm rồi chị
5159,Sao ban nãy anh chị xóa video vậy ạ?
5160,Xem đầu nè!!!
5161,"Hihi,  Xem sớm nè🤗🤗
Yêu chị Thơ nhìu lắm!!😘😘😘"
5162,Xem đầu 😋😋😋
5163,Yêu chị thơ quá
5164,Yêu chị nhiều❤❤❤
5165,Xem sớm điểm danh😋😋
5166,E la nguoi dau xem
5167,Hay quá chị ơi
5168,Có ai đg coi hk
5169,Xem đầu
5170,Xem đầu
5171,Chao chi
5172,Em xem đầu tiên
5173,"Team xem sớm điểm danh nào :3 
👇🏻👇🏻"
5174,Oh yeah Say sky ơi
5175,Comment vs like đầu tiên 😚😚
5176,Chị ơi tại sao video trước chị lại xoá vậy
5177,E là người đầu tiên like đầu tiên xem
5178,Xem đầu mong cj trả loi
5179,xem sớm ^^ zui quá cj ơi
5180,Hello chi
5181,xem đầu 🤣🤣😍
5182,Sao hồi nảy chị xoá vậy ạ
5183,Team love chị thơ
5184,Yêu chị ❤
5185,Xem đầu hihi
5186,Like đầu ngại quá
5187,Nhớ là mới xem r mà ......
5188,Xem đầu
5189,Xem đầu
5190,Xem đầu
5191,Xem đầu
5192,Em xem đầu tiên
5193,100 like tìm nhà thơ nguyễn xơi thơ
5194,xem đầu
5195,Xem đầu
5196,Xem đầu
5197,Xem đầu
5198,Taem sớm điểm danh
5199,Làm làm thử rùi
5200,Tem xem sớm  điểm danh
5201,Em không thich chi tho nguyen  em chi thich chi mtthy
5202,Won chị giỏi thật
5203,I love you cj thơ
5204,Ai srm sớm nảo
5205,Em xem đầu ạ
5206,👏👏👏
5207,Sợ quá!!!!
5208,Chi tho de thuong qua
5209,Sắp đặt hay
5210,Nghe la bt xao r
5211,Xem sớm!!
5212,Hays nguoi ta biet tu doi nao roi gio moi chi ai thay dung cmt nha 😁
5213,Không ngờ hôm nay mình sẽ sớm
5214,Team yeu chi Tho diem danh nao
5215,Tối em là mà không cần cái tô
5216,Hello
5217,Chi trong sieu that
5218,Ai xem sớm điểm danh
5219,Có ai còn nhớ bé Thỏ không
5220,Chi tho oi me em lam gia chi de 2 ngay thoi chi a moi giong mua
5221,Bon23232TV. 65+23=?
5222,Nha em trong gia ne
5223,Ngày lễ ai về quê giống mình không ?
5224,kinhhhhh quá chị ơi
5225,em từng làm giá đỗ nộp môn sinh học mà tại trồng trước vài ngày nên nó cao hơn. lên lớp thấy mấy đứa nó làm bé xíu .có thằng bảo em mày xịt thuốc tăng trưởng hả
5226,Hello
5227,Chi oi e muon chi choi thu thach 24h voi anh tieu bao bao chu chi cu choi mot minh thi chi buon lam
5228,Hello
5229,Sao chi khong tra loi cau hoi cua em?
5230,Hello
5231,Sinh lớp 6 có
5232,xem đầu
5233,xem đầu
5234,Team xem đầu
5235,Chị láo toét
5236,Hi
5237,"Vừa xem vừa đọc cmt 😅😅😅


Có ai như t k"
5238,Chu tich gia vo lam gia do va Cài ket
5239,em yêu chị
5240,Em thấy hơi sợ sợ
5241,Team xem som diem danh
5242,sao chị xóa video
5243,Video hay quá
5244,chi tho de thuong qau di.
5245,Team xem đầu
5246,Em trong roi rat thu vi😀
5247,Em cũng là người like đầu tiên luôn
5248,Hay quá chh ơi
5249,cj ơi sao dạo này  e ko thấy cj làm video về hồ bơi  sắp đến. Mùa  hè r mà
5250,cj thơ có chơi tik tok ko
5251,13 : 44 phút   = 4 ngày
5252,Xem đầu nè
5253,"Ai muốn Chị Thơ thực hiện thử thách 24h like nhe 
👇👇like ở đây"
5254,Chúc các em cbi thi học kì đạt được nhiều điểm tốt nha. Chúc mọi ng kì nghỉ lễ vv 💓💓
5255,"Lớp sáu rồi mà vẫn thích xem những các clip của chị Thơ 
Vì học lớp sáu nên sắp thi rồi ngày 2 tháng 5 là em phải thi mong nhận được lời chúc may mắn từ chị Thơ"
5256,"Chị dễ thương quá
Team hôm nay thi học kì 2 điểm danh"
5257,"chúc các bạn thi học kì được nhiều điểm tốt, gặt hái nhiều thành công!:))))"
5258,Chúc những bạn like comment này thi cuối kì điểm cao nha :*
5259,Chị Thơ ơi ! Em lo quá vì em sắp thi cuối kì 2 rùi mà em con phải thi vào cấp 2 nữa cơ. Ai mà cũng lo giống mình thì cho mình một like nhé😊😊😊😊😊😊😊😊😊😊😊😊😊😊😊😊😊
5260,Chị Ơi Khi Chị Ở Trong Mê Cung Thì Em Thấy Hơi Nhức Đầu Đó Chị
5261,"Có ai 30/4 với 1/5 ở nhà k
Học bài ko điểm danh"
5262,"em được bố mẹ cho về quê nội chơi đấy chị ạ.
nhưng em săp phải thi cuối học kì 2 rồi chị ạ😊"
5263,Sắp thi cuối học kì rồi ! Mình lo quá ! Có ai lo giống mình không ?
5264,Bố mẹ  có  2 cái đt đều  đang ký kênh  chị thơ hết  luon
5265,Chi tho nguyen hai lam vi do 24gio di
5266,Chi ooi chi ann tom alskat di chi co 4000000
5267,Số người đã gắn bó với chị Thơ suốt mấy năm qua 👇
5268,"Chúc ai like được comment này sẽ được nhiều điểm 9 - 10 nha😄😄😄😄😄






Chúc mọi người có một kỳ thi tốt nha🤗🤗🤗🤗
(😁😄☺️🙂🤗)"
5269,Chúc các bạn thi tốt luôn luôn điểm 10.🐀
5270,wow  .............da qua
5271,Chị ơi e đc chơi 1 nơi rất vui . Là chơi với 4 bức tường 😂😂😂😂
5272,Chị Thơ Nguyễn dễ thương quá yêu chị ❤️❤️❤️
5273,Chị thơ nguyễn ơi mấy giờ chị thơ đăng video ạ
5274,"This FanPekka look same as in aeonmall in Johor Bahru, Malaysia"
5275,Em mới ik hc về là xem video của cj lul
5276,"Woa,*******"
5277,Chúc tất cả các bạn like cho mik có một kì thi tốt nha!❤️❤️❤️
5278,"Team muốn chị Thơ làm thử thách 24h giơ tay
👇🏻"
5279,Em yêu chị ther nguyễn nhất trong làng du túp ber Việt Nam luôn á chị 😍 chị đẹp tựa như an na beo 😍 e mê á
5280,"Chúc các bạn thi tốt hết nha ❤
Ai sub chéo ko ạ ❤"
5281,Nhiều chỗ để chơi quá nhìn mà mê chắc em ko chơi hết mất 😶
5282,Love it~❤️❤️
5283,"Em đang ôn bài, thấy thông báo em vẫn nhảy vô coi lun. Hihi!!!"
5284,Em thách chị ra ngoài nghĩa địa dò phần mềm bắt ma
5285,1 tháng sau là ngày 1/6 chị tặng quà cho tất cả các em nhé😚😚😚😚😙😙😙
5286,Mong nhung nguoi xem clip cua chi Tho Nguyen thi hoc ki dc diem cao roi nghi he xem nghien luon :)))
5287,Tuy không được gặp chị nhưng khi em xem video của chị và bấm like cho chị thì em cũng cảm thấy rất vui vẻ rồi. Em yêu chị Thơ rất nhiều.😘😘😘😘😍😍😍😍❤️❤️❤️❤️👏👏👏👏
5288,Nhìn cj Thơ giống nh😂😂ư một đứa con nít v
5289,4:48 có chị NYN KID
5290,Chị ơi chị làm thử thách 24h sống trong một cái lều tranh
5291,"thọ của cj thơ nguyễn sẽ dựa vào đây 
     👇🏻👇🏻👇🏻👇🏻👇🏻👇🏻"
5292,Thấy thông báo là e vô liền
5293,Xong minh len tang 3 la khu vui choi phai ko chi🤣
5294,trời ơi em xem trể rồi xin lỗi chị nhé
5295,Em thích nhất là căn hầm bí mật và cái nhà nhỏ cuối cùng mà chị xây ý. Em ước được một lần tới đây quá
5296,"Chị ơi vé trẻ em 8 tổ
 Vé ngừi lớn23 và
26 tổi là bao nhêu tièn"
5297,"Fanpekka tuyệt quá hôm nào có dịp chị rủ anh Tiểu Bảo Bảo đến Fanpekka khu xây dựng,sau đó chị cùng anh ấy xây nhà và chơi đóng giả vợ chồng ở đó nhé"
5298,Chị Thơ Nguyễn dễ thương quá 😃😃😍😍
5299,"Chị ơi nhớ đăng nhiều video clip trong dịp 30/4 ,1/5 nha chị"
5300,em thấy là chị sẽ ko có video thử thách 24 giờ hoàn hảo đâu chị.
5301,Em cũng den cho khu phố tuyet rồi ạ
5302,"Ai muốn Chị Thơ thực hiện thử thách 24h like nhe 
👇👇like ở đây"
5303,"Sao hôm nay chị thơ nhìn dễ thương quá 
Bộ đồ màu vàng 
Em thích màu vàng lắm chị ơi 
À hay chị làm thử thách ăn tất cả các món ở trong aeon mall bình dương nha chị 
Em ko gửi quà tặng vì em nghĩ mình thương người ta ko phải cứ cho quà là được"
5304,Em cố gắng xem sớm nhất mà vẫn chậm hơn 345 người khác 😭😭😭
5305,*AI FAN THƠ NGUYỄN ĐIỂM DANH*🙋🙋🙌🙌🙌
5306,Chị thơ hay chị làm 2 4 giờ trong quán KFC được không ạ 😘💖💕❣️💝👇
5307,Chị ơi sao em không  thấy chị quai phim nữa vậy
5308,1 vé vào đó bao tiền nó nằm ở đâu ở đất nước VN
5309,Chị ơi em coi sớm nè chị mong chị thả tim
5310,Chị hay làm thử thách 24giờ trong thuyền mái tre di!!!
5311,Ai sắp thi học kì 2 dơ tay
5312,Chị chị thơ Nguyễn quay vòng vòng làm em thấy
5313,Chị ơi FANPEKKA có ở Hà Nội không ạ?
5314,Xin chào chị Thơ Nguyễn nha em tên là Nguyên chúc chị và anh tiểu bảo bảo không thúi😂😂 một buổi chiều vui vẻ nha.
5315,chị Thơ dễ thương quá
5316,"Vô bình luận coi thấy ai nghỉ xong mới thi học kì.
Còn tau thì thi xong lun rồi🤣🤣"
5317,"Chị sướng ghê!!!
Em ước được làm em gái ruột của chị quá!!"
5318,Fan của chị Thơ Nguyễn đâu điểm danh nào
5319,Ai sắp thi thì like cho mình nha!
5320,"Ai muốn chị thơ thuc hien 24gio 
Trong du thuyền"
5321,Phan cuồn của cj thơ nguyễn đê đâu hết rồu
5322,cho mình hỏi chị Thơ thứ mấy ngày giờ
5323,Thấy thông báo là vô liền nhưng ko xem đầu được 😭😭😭
5324,"Chị tho sướng quá , em ở TP Hà Nội nên em không đến đấy được"
5325,Chị ơi em thấy ngày càng vô duyên rùi em ko thích mấy video chị làm nữa rùi
5326,Chị vẽ mặt anh TBB xấu quá 😊
5327,7:56 cj kia k mặc quần à
5328,Hiện đại thế. Ngay từ lúc vào cửa luôn. Nhân đây em mới làm youtube được 2 tháng về chủ đề âm nhạc. Mong mọi người giúp đỡ với ạ
5329,tuyet voi qua chi tho oiiiiiiiiiiiiiiiiiiiiiiiiiiiiiiiiiiiiiiiiiiiiiiiiiiii   i love you tho
5330,Í giờ em mới phát hiện ra là kênh chị thơ được 6 triệu người đăng kí rùi đó hihi vui quá! !!!!!!
5331,Chị tho oi em muốn chị thục hiện thử thách 24h
5332,Chị Thơ thật dễ thương ai thấy đúng thì cho một like
5333,"Chị thơ ơi em hỏi 
Chị đã đăng 1 video lên em nhận đc thông báo xong chị xáo luôn là sao"
5334,Chúc mọi người có một kì thi đạt kết quả cao
5335,Xem sớm nè cj ơi. Vui qé🥳😂
5336,"Em ở QUY NHƠN chị ơi. Hu...hu, hơi bị buồn😔😔😔😭😭😭"
5337,Xem 36 vui quá là vui team xem sớm đâu
5338,"nghỉ học xong lớp học của mình phải thi rồi bạn nào giống như mình cho mình một like nhé
và chúc các bạn thi thành công và đạt được nhiều điểm 😊😊😊😊😊😊😊😊😊😊😊😊"
5339,Em muốn chị làm thử thách 24 sống trong nhà bằng gỗ giống như Lâm TV
5340,Anh tiểu bảo chắc chịch chị thơ đc vài lần rồi...  Chịch chị thơ chắc phê lắm nhỉ... Ước đc 1 lần chịch chị thơ..
5341,Chúc các bạn có một kì thi tốt đẹp☺
5342,Có ai lớp 8 rồi mà vẫn nghiền cj thơ ko nè ....? 😂
5343,Em yêu Cj thơ Nguyễn nhiều lắm ! Hihi....
5344,"Chị thơ sướng quá luôn, ngày lễ em ở nhà học bài để ôn thi nữa, chúc mấy anh, chị, bạn thi tốt nhà😆😘"
5345,Fan chị Thơ đâu rùi.
5346,"Huhu:((
Monkey.D.Luffy thành Monkey.D. Bảo Fy"
5347,Tên nhà vui chơi đó giống tên em đó là peka
5348,"chị thơ nhảy dễ thương ghê lun
Em thấy thông báo là vào nhưng lúc nào cx chậm 1 giây"
5349,Chị thơ à em được ra bà ngoại rất vui em chỉ chơi với cả ăn em rất vui  ngày hôm sau là ngày 1thang 5
5350,Thank you
5351,nó bên trong siêu thị đúng không chị Thơ Nguyển
5352,"Chị nổi tiếng thật 
Em thấy thông báo là bay vô liền nhưng đã hơn 200 lượt xem huhu"
5353,"Cj thơ thì mập mạp
  Ah TBB thì ốm nhôm 
     Lời khuyên cho em TBB là: ah ăn nhìu vào cho mập bằg cj thơ nhóa"
5354,Chị ơi em thấy chị bận đồ công chúa đẹp á chị
5355,Chị thơ sao chị không quai thốn và thồ
5356,Tưởng đóng phim gửi thời thanh xuân ấm áp của chúng ta......
5357,bà nhân viên bả rap như đúng rồi luôn!!!
5358,"Chị làm thử thách 24h trên võng i ai đồng ý 
👇"
5359,Huhu lớp em phải học đến thứ hai mới dc nghỉ
5360,Mấy bạn thử đoán điểm thi của mình ik nào
5361,Em thấy trong báo là bay zô liền mà vẫn thua mấy trăm ngàn người 😢
5362,"Ai muốn chị Thơ ra video Thử thách 24 giờ ở Fanpekka
Thì cho cái like
👇🏻👇🏻👇🏻👇🏻👇🏻👇🏻👇🏻👇🏻👇🏻👇🏻👇🏻👇🏻👇🏻💋"
5363,Lớp 10 rồi nhưng vẫn muốn vào :v
5364,"Team vừa thi HK2 xong điểm danh
Nếu các bạn thấy video nào của chị Thơ cũng hay thì hãy like ở đây
👇👇"
5365,6m sub 👏👏
5366,Team sắp phải thi kì ll ko
5367,Hôm nay chị đẹp quá
5368,Thồi đó em thích chị nhưng bây giờ em ko thích chị nữa hahahahahahaha em ghét chị
5369,Chị ơi năm ngày nghỉ lễ đó là phải ôn thi đấy
5370,"Nhà chị ở đâu vậy,còn số đt thoại"
5371,Em thấy thông báo bấm vào rồi thì người ta lại bảo là Video nayfddax bị người dùng xóa
5372,Chi Tho oi xo phai cho do trung tam mua sam dung ko chi
5373,Chị thơ Nguyễn ơi ban trai chị là tiểu bảo bảo thủi đúng ko
5374,Cj sướng thật lễ cj dc d chơi còn e thì ở nhà học bài để thi
5375,Yêu chị Thơ và anh Tiểu Bảo Bảo chị làm thử thách 24h ai
5376,"Em luôn ủng hộ cj , cj thơ lùn xinh đẹp và dễ thương 😍"
5377,Chị tho nguyễn xinh xắn đáng yêu quá hihihihihihi 😻👯😍
5378,(^_^ ) (=-=) (÷-÷) (+_+) (!_!) !!!
5379,Cái nhà banh này làm mk nhớ đến Gửi thời thanh xuân ấm áp
5380,"Chị ơi ,em muốn đến shop chị ,nhưng em không biết shop của chị ở đâu hết ,chị đọc bình luận của  em chị nhớ nhắn địa chỉ shop ở đâu nhé chin"
5381,Chị thơ Nguyễn nhảy đẹp nhất thế gian này
5382,Vé bao nhiêu tiền vậy chị
5383,Sắp thi rồi chúc các bạn may mắn thi tốt nhé
