,Comment
3213,Ko phải giong chipu đảm bảo muốn làm xấu mặt chipu chứ gì
3214,Bớt :)))
3215,Nhìn như chưa chích ngừa
3216,Chị bị sao vậy -_- ????? Phiêu còn không biết...chán vãi ra
3217,tội cho chi pu mong chi pu sẽ cố gắng nhiều hơn nữa
3218,"Trước thì k thích ChiPu lắm. Giờ thì thích nhiều hơn!. Dám làm những gì mình đam mê, ước mơ. Thì đâu phải quan tâm thiên hạ nói gì!.
Cố lên Em!."
3219,chỉ cần đi luyện thanh nhiều thì OK r có gì phải ném đá nghề ca hát để đi kím tiền thôi có đứa nào đi hát mà ko lấy tiền không cạp đất ăn àk
3220,Lệ rơi.... này là Pu Rơi nhé.... lol
3221,giống kiểu mời khán giả về hát
3222,chaien
3223,Qua đây có thể chứng minh không phải xinh đẹp là hát hay.. 😅😅..ố ô ố ồ ..
3224,bị giật kinh phong hả chi
3225,Hài vl =))
3226,cười đau bụng 🤣🤣🤣
3227,0:38 từ hôm nay em sẽ trắng mông chờ
3228,trời ơi! hát như này thì mình cũng hát được ko cần ôn luyện gì hết
3229,Chipu hát hay mà.ad đừng dùng một chút tiểu xảo âm thanh.
3230,Ít ra em ý ko chơi nhép..
3231,Xem tất sợ dì 😎😎😎😎
3232,"Đầu lòng hai ả tố nga
Chị là Chipu em là linh ka 😁😁"
3233,"Từ trc giờ vẫn rất quý CP nhưng bạn này hát thật sự dở, giọng yếu lắm, hát như đọc, k có nhịp j cả"
3234,Bài gì đây
3235,Dám
3236,ahaha 1:35
3237,Chỉ được cái đẹp😂
3238,"Cố gắng lên e ủng hộ cj
Đừng chỉ nhìn vào những mặt xấu r chê ng khác hãy nhìn vào những mặt tốt của họ Mà nhận xét để họ cố gắng hơn và tiến bộ hơn mn ạ"
3239,"Cố gắng lên e ủng hộ cj
Đừng chỉ nhìn vào những mặt xấu r chê ng khác hãy nhìn vào những mặt tốt của họ Mà nhận xét để họ cố gắng hơn và tiến bộ hơn mn ạ"
3240,Ca sĩ mình cảm nhận hay khi hát live.vì hát live là giọng thật ko qua chỉnh âm.hát live ko ra gì thì dẹp cmn MV đi.ra MV chỉnh âm cho hay thì dẹp làm ca sĩ đi.nghe đau tai quá.có nghe mới biết đau tai cỡ nào
3241,Bài này là bài gì thế mn??
3242,Bài này là bài gì thế mn??
3243,"Cùng xem giọng hát live của các nữ ca sĩ Việt Nam nhé , Ai hát live tốt nhất ? : https://youtu.be/V81urQurzUQ . <3"
3244,Ôi phải chi Chi Pu đừng hát thì cố ấy đã ko có anti fan
3245,Hát nhảm vl lạy là sư Phụ hát vỡ cả tai. :(
3246,Lệ rơi đâu vào nhận họ hàng đê
3247,abcd
3248,Chừng bào Chipu tỉnh ngộ đây ......
3249,tệ 😂 quá
3250,Tạo nghiệp ít thôi ko thik thì xem cái khác ở đây mà chế giễu người khác
3251,thay dau gi de thuong ma .vua hat nhay hoi met
3252,"Đúng là ""Không học hành gì cũng nỗi tiếng"" :b"
3253,K ra gì
3254,zậy mà cũng gọi là ca sĩ hả ca cái cc
3255,Làm ca sĩ dễ . Quan trọng là có ÷ ò ó o đc ko
3256,Đhs cứ đến đoạn gáy ò ó o lại dí mic xuống khán giả :|
3257,^^ th chỉnh clip ác vl ngây khúc độc ko
3258,"Giọg hát như gà mắc đẻ á, mà cứ thích hát"
3259,Ca si cc
3260,"Chị ấy nghĩ mình đẹp và chị có quyền làm những j chị thích , thật thì thích chị dong phim hay style mặc đồ của chị ấy chứ k dám nghe chị hát"
3261,Hay
3262,mik thấy hay mà
3263,1:03 có gì đâu hát như vậy đúng òi
3264,"mình thấy hát cũng bt. live mà. ca sĩ nào hát live chẳng k hay bằng thu âm.  cứ nhảy ầm ầm xem có hết hơi k. 
tôi k bênh ai cả. nhưng nghe mấy cái chửi nhau này nọ nghe nó k xuôi.  ai chả có đam mê. chipu thích làm ca sĩ thích hát.  ai nghe đc thì nghe k nghe đc thì đừng nghe gì phải buông những lời không hay như thế."
3265,Quẩy lên nào 😆😆😆
3266,"mình thấy hát cũng bt. live mà. ca sĩ nào hát live chẳng k hay bằng thu âm.  cứ nhảy ầm ầm xem có hết hơi k. 
tôi k bênh ai cả. nhưng nghe mấy cái chửi nhau này nọ nghe nó k xuôi.  ai chả có đam mê. chipu thích làm ca sĩ thích hát.  ai nghe đc thì nghe k nghe đc thì đừng nghe gì phải buông những lời không hay như thế."
3267,"Hát dở k quan trọng,quan trọng là thần thái của c 😂😂"
3268,Xinh de thuong
3269,đm đã hát hay bằng người ta chưa mấy bọn điên
3270,Háhá
3271,hát thấy gớm... 😱😱😱😱😱😱😱😱😱😱😱😱😱😱😱😱😱😱😱ghê gớm ghê ghê ghê
3272,tội nghiệp cho những ai nghe nhạc của Chị.....
3273,hai vl
3274,linh ka lam j o day vay?
3275,"Đừng tưởng sự cố gắng của bạn dựa trên những việc luyện tập vũ đạo. Truoc hết bạn nên luyên thanh như mấy đưa nhỏ học thanh nhạc, và nghe gv thanh nhạc cho bạn lời khuyên THẬT"
3276,Để tao bảo lệ rơi quê ta dạy ngươi hát mới được.
3277,"Thiệt tình là dở quá, Chi nên tập luyện nhiều hơn nếu muốn làm ca sĩ"
3278,😂😂😂😂😂🤣🤣🤣🤣🤣 buồn cười vl cười từ đầu clip đến cuối clip
3279,"Ko được thì đừng cố em Pu ạ, ko là nhiều người sẽ tụt huyết áp khi nghe em hát đấy"
3280,"Chất giọng của Chi Pu mình nghĩ nếu luyện tập hơn chắc có thể cũng ok đấy nhưng mà khuyên thật lòng là nên về luyện tập nhiều hơn nữa rồi hay đi hát -_- với cơ bản bài này cũng éo có hay, mà cứ hát đi hát lại mãi, cứ nghe cái Ò Ó O Ò là muốn đập mẹ cái máy tính."
3281,chị pu hát rất hay
3282,Dở hơn chữ dở
3283,chị ơi em có cảm tưởng là chị hát chỉ để cho lỗ tai người nghe bị ung thư ấy
3284,Chi ạ.nghỉ mẹ đi=.= hiếp dâm âm nhạc
3285,. Tròi kiểu tóc của @@ ariana grande  -- của tui!!!
3286,Do bài này cần vũ đạo... Nếu casi vừa hát vừa nhảy đôi khi bị hụt hơi nên sét thôi.... Sao phải soi kỹ làm chi... Chẳng phải khán giả sung như thế ư???
3287,Cười vỡ bụng 😂
3288,Hết chứ😆😆😆😆
3289,Bài này tên j vậy m.ng
3290,"chị à e cũng thích chị lắm , chị thân thiện , dt , nhưng mà chị hát ko hay gì cả , những bài hát mà chj hát e nghe nó nhảm nhảm ko có chút gì là sâu sắc á chị ơi , chi ko nên làm ca sĩ thì hơn , e khuyên chân thành,"
3291,Vui thôi đừng vui quá -D
3292,thấy cũng hay mà
3293,Tra tấn tai nghe
3294,dù thế nào thì tớ vẫn thích chị Chi Pu 😍😍😍😍💕💕💕💕💕
3295,Nhìn phong cách thấy giống giống của chị Minh Hằng.. cố tình chăng
3296,Thất vọng quá
3297,FC  Wendy Thảo này gọi là lạc tông TRỚT QUỚT
3298,Nhay đep.nhung hat tê qua
3299,Tui thấy cx đc mà
3300,• Vừa hát live vừa nhảy là khá khó nhé :) nhất là đối vs những người chưa chuyên nghiệp :) việc bị đuối hơi và lệch tông là không thể tránh :) nhưng k thể phủ nhận là Chi Pu giọng hơi yếu nên k đủ hơi để lên cao :) dù sao thì mong chị cố gắng hơn
3301,Nói thật bản gốc hay bao nhiêu . Live ko có chỗ nào hay mà còn hát lố 👎👎👎
3302,"kệ nta đi mấy thím !
cứ như việc của mình ý"
3303,động lực để tất cả mọi người có thể tự tin hát hơn! không có dở thì không bao giờ có hay! có cố gắng là mừng r! năng khiếu 1 phần! 1 phần phụ thuộc vào bản thân! nếu dư luận tạo áp lực quá lớn! thì đấy mới là điều tệ hại!
3304,Tao vẫn xem hết vì tao fan chipu
3305,Do kinh khung
3306,đúng là jo taoco the lam ca si dc roi
3307,Đúng la thảm họa
3308,Hát dở quá....😂😂🤣🤣🤣🤣🤣🤣🤣
3309,cái gì qua thời gian sẽ thay doi ma chua j ma da chui nguoi ta roi
3310,Đừng nhìn về quá khứ mà nên nghĩ về hiện tại chipu  ko hát hay nhưng tương lai của chi là một ca sĩ thần tượng của bao nhiêu người đấy
3311,"thật không thể tin nổi,là việt nam lại có 1 sao lên làm ca sĩ như thế này,làm xấu nhạc việt.không biết tự lượng sức mình.nghĩ mình có tiền mình đẹp mình có quyền hay sao.nhảm nhí"
3312,người ta hát dỡ thì thuj sao mn chửi dữ z:)
3313,mặt xinh nhảy đẹp thần thái tốt
3314,me kip dang nhất đầu rap cái này muốn nhập viện luôn
3315,Ác mộng của tôi chính là giọng hát tuyệt vời của Chipu.
3316,Giờ Chipu đã cải thiện giọng hát nhiều rồi :3 !!
3317,Nghe trong zing thì rất tuyệt vời. bình luận thì khen chipu rất là nhiều và khi lên youtube nghe chipu hát thì rất cảm động và muốn rơi nc mắt😂😭
3318,"hay mà, thấy bthg mà do m.n bắt lỗi nhiều quá thôi
(cảm thấy video xúc phạm vlozz ạ😏)"
3319,Live tệ nhất lun á hát cx tệ chỉ đc cái hơi đẹp
3320,Mo nhon that g
3321,Nói thật thì CP hát k chán đến tek nhg k đến mức làm ca sĩ. Nếu chỉ nói là hát chơi thôi thì đc nhg lại bảo là ca sĩ thì ....
3322,Troi troi hat nhu ram vay do oi tai toi
3323,"Vừa nhảy vừa hát thì có mấy anh chị hát được, nhưng vẫn có mấy anh chị ca sĩ bị hụt hơi mà.  Nên đâu trách được."
3324,Tra tấn người nghe
3325,hát dở quad
3326,"này là còn có nhạc đệm á,hát chay nữa thì thôi rồi..."
3327,Hát dở dã man :((
3328,Mặc dù Chi hát ko hay nhưng mk vẫn là fan của chi anti của Chi cứ thoải mái làm ra những video này đi mk vẫn mãi là fan Chi thôi
3329,"Mình nghỉ hát hay ,hây hát dở thì ai thích nghe thì nghe chứ hok cần phải nhận xét như z ..."
3330,Xem xong tao lại thích link ca hơn ôi live cp như xịt
3331,Tởm
3332,Giọng cj yếu quá nếu  k thì hay lm nhé ...
3333,Tui nghĩ Chipu chỉ nên làm diễn viên thoi chứ bả mà làm ca sĩ chắc có nước sân khấu ở Việt Nam sập hết
3334,Má ơi nó phiêu kìa
3335,new achievement unlocked - Em đã nghe được hết các bác ạ. E tự đi thưởng chi mình 1 ly cà phê đây !
3336,C hát ko hay những đi cái quá tự tin
3337,ghê
3338,bị  lỗi thì đã sao vẫn hay mà
3339,hát hay quá à tao nghe nhằm 😂😂😂😍😂
3340,Tởm
3341,Lạy hồn ! xin nín đi được không
3342,Chị Chipu bị khang tiến đó 😫😫
3343,Chưa chắc ca si nổi tiếng đã live đc như vậy chẳng hạng như ai đó sao k nói gato vừa thôi mấy má
3344,Thích cai. Phong. Cách nay ....may. cai. Nguoi nay noi toi noi lui chan. Khac. Gi . Get ...ma. pha. Lan. Gen ti
3345,Dam
3346,Tội nghiệp cp
3347,"từ từ rồi sẽ hay. Như ST - MTP luk đầu hát live cũng chán bỏ bà. nhưng h vàng ngày càng hay. cái j cũng cần có thời gian học hỏi,rèn luyên"
3348,ai ko nghe hết bài này nào 😵😵😵😵😵😵😵😵😵😵
3349,"Thấy dân mạng nói nhiều quá, phải vào xem ntn.....hát như này có ngày đi diễn bị ăn đá là bình thường"
3350,Cháu đang rét nghe xong đóng băng 2 ngày giờ mới hết để cmt
3351,cho hỏi đây là bài gì mặc dù hát k hay nhưng bài hát này hay phết
3352,Nhép lộ vkl
3353,Lệ rơi hát còn lổi tiếng đc mà chipu rồi sẽ lổi haha
3354,K khác gì tùng sơn
3355,Cười k nhặt đc mồm
3356,Thanh Lam khen quá nên vô coi ca sy Chi Pu ca live như thế nào. Hay phech. Cười đau bụng lun.
3357,hát như vả vô mặt người ta z đó
3358,Chipu này nó hát dở chưa từng thấy.....tẩy chai nó đi...
3359,"that la kho loi 
ai do giet toi di !!!"
3360,Cái j cũng có trừ giọng hát
3361,Link ka rồi đến chipu toàn cặn bã của ca sĩ
3362,A lạy e chipu ơi e quá dũng cảm
3363,Chi Pu hát live cug hay mà
3364,Tởm. Biết hát live kém thì đừng nên nhảy
3365,Mất hình tượng tốt nhất đừng hát đc nhiều ng yêu quý hơn
3366,Cứ hở là e thành ca sĩ. Wan trọng là fai biết show hàng
3367,Giọng chi pu yếu quá không ra hơi lùn học hic
3368,ko chỉnh âm thanh là banh não má ơi cứu con~~~~
3369,Đoạn cuối nhìn mặt Chi mà thấy hao hao e Linh Ka. -_- chắc là do mắt tôi thôi.
3370,Giá mà youtube có nút haha
3371,Minh thay nguoi nao lam ra cai nay chac cung ranh lam
3372,Thật lòng k ghét CP mà nghe CP hát nói đúng 1 câu dỡ quá
3373,"Tôi là người miền bắc ,,nhưng ko thích cô này, vì giọng hát ."
3374,Hát hay bằng người ta ko mà chửi hoài. Tưởng mấy người hát hay lắm comment như đúng rồi.
3375,Hát như vầy chết luôn! Giống bò 🐮🐮🐮 rống quá! 😅
3376,Giờ có tiền là cầm Mic thành ca sĩ! Nói ko phải ghen tỵ chứ khâm phục bà này vch giám mang giọng này trước ngàn người hát! 😂😂😂
3377,Vũ đạo cũng đc mà
3378,1.36
3379,Đm chi pu đi hiếp dâm thính giác tao rồi
3380,"Trước kia là diễn viên chuyên nghiệp
Thế nhưng giờ lấn sang âm nhạc 😂"
3381,"Chẳng mong chị sẽ hát live tốt, nghe nhìu người chê nhưng ko tin, giờ nghe đc 1 nửa tắt lun, lê xuống đây cmt nè :>"
3382,Làm ơn đừng lên sân khấu nũa tôi thấy xấu hổ quá
3383,Tr đọc thần chú hả Má
3384,khi mà hát kia cx là giọng thật của chị chi pu mà m tưởng hát hay lắm hả mày bốc phốt chi pu
3385,nghe như gạ địt
3386,Bài nào cũng cà giựt cà giựt .. 😅😅
3387,Biết là pu đam mê hát rất ủng hộ.. nhưng giọng hát k hay thì đừg nên cố làm gì..vì hát cả thế giới này nghe chứ k phải mìh mìh
3388,Dám hay mà
3389,Y hử sắp đứt hơi ý kkk
3390,"vừa hát vừ anhayr thì có thể hụt hơi có sao, địt tổ đứa nào hát hay = nó chưa"
3391,"Hay mà 
Hát đc như bả ko mà ns nhìu =_="
3392,Hình như Chi pu bị Gil Lê vét máng rồi ah
3393,Buồn vào xem hài
3394,nghe thiên hạ đồn chi pu hát tệ hát...vào nghe thử thấy ns chung là nếu chịu khó nghe thì cũng đc
3395,Vừa nhảy vừa hát khó lém.... :))
3396,Nửa đêm nằm nghe cười như điên
3397,Làm video có tâm gớm. Biết delay những đoạn cio ấy feeling. Thật tuyệt vời
3398,tao ghét mày võ đao mày làm xâu măt chi pu
3399,"Hát được như chj ấy ko mà bầy 
Đặt chữi........OK"
3400,Tui lại trời ạ giọng mới ăn ớt hạ
3401,Hèn chi bị hương tràm chê là đúng
3402,Sao bà này làm được ca sĩ vậy?!
3403,"Thảm hoạ âm nhạc, thất bại của thất bại"
3404,Giọng hát thảm họa nhất mọi thời đại
3405,dóg thah niên dậy thì bị vỡ giọg... tiếg như vịt đực..!! :))
3406,"LOVE YOU MY IDOL , CHI PU"
3407,Mấy MV của Chi pu toàn chỉnh giọng thoi.Đây là giọng thâtj
3408,o vn minh sao cs nao cug dc tung hô het z troi mẹ
3409,"Nghe nó hét lên "" let go "" mà buồn cười quá"
3410,mới đầu nghe giọng là biet yếu rồi
3411,Trời ơi. Phải biết giới hạn về tài năng của m đến đâu chứ. Hát như gà gáy
3412,thì ra đây là bát hát của vegat
3413,Hát như bò đái tấm tôn
3414,Hát j dở v tr
3415,Cũng đâu đến nỗi
3416,"Chi Pu xinh đẹp,thông minh,lầy,cực sexy,diễn tốt,múa dẻo,vui tính,hòa đồng mọi mặc đều tốt nhưng hát ... ...(Mà lần đầu tiên thấy có 1 cs có lượt dislike nhiều hơn like)"
3417,Mày là thánh rảnh long đi dìm hàng người khác
3418,"Bao giờ chipu tỉnh ngộ đây, từ khi chipu làm ca sĩ mình hết thích luôn"
3419,Hát như vậy mà cũng gọi là hát đó hả :)
3420,Nó cắt Ra rồi Lập lại Hài VC
3421,Sao live từ hôm nay trước hay lắm mà.
3422,fan chipu điểm danh . kệ mẹ dư luận.
3423,nghe vua mac cuoi ma vua ko theo dung tone nua
3424,lặp lại mấy đoạn làm sao hay
3425,Chưa có kinh nghiệm hát live thôi mà
3426,Hay ma moi nguoi
3427,Câm!bố đập tường !!!!!!! Không bảo chipu
3428,Có ai vừa nhảy vừa hát nỗi kh ?
3429,"Hóa ra ca sĩ là vậy , thảm họa quá thảm họa"
3430,"Xinh thì cũng tạm đc, éo phải xinh lắm. Thân thể thì gầy nhom, lép. Có mỗi cái lý lịch sạch thì tự làm bẩn. Chưa đến mức ô uế, quay đầu lại vẫn kịp đấy"
3431,sao có người hát thấy gớm vậy
3432,sự thật luôn luôn phũ phàng 😢😢😢😢
3433,"Giọng hát cảm động quá T.T nhất là lúc ""quẩy lên nào! Jump,jump,jump"" nghe mà ko cầm dc nước mắt!"
3434,Cái bài gì không hiểu gì hết
3435,"Quỳ đứa làm video, cười vỡ mồm"
3436,Vậy Sao có thể làm ca sĩ hả trời  .. Hồi trước hâm mộ chipu ghê  . Giờ nghe giọng hát live.  Thất vọng ghê . Hát dở hơn người bình thường  . Giọng khô  . Âm ko trong  . 😑
3437,Tởm quá
3438,Cầm mic là thành ca sĩ 🤣
3439,Coi bã hát k cần coi hài 😂 😂
3440,😂
3441,Bài j z ??? Quên tên mất r :*(
3442,"Ai còn nhớ lúc chipu đóng 5s tập người nổi tiếng 
Mọi người coi lại nhé bh thành thật rồi 
( trích 
Dù giọng em có như con ếch ộp chỉnh sửa là ok hết )"
3443,. tớ không thể nghe full bài được :)
3444,".....hk pt ns j lun.....
Chi ơi tỉnh ngộ dùm ik
Sợ hú hồn"
3445,Chệch tông tí thôi mà mà cũng mắc cừ thiệt 😂😂😂😂😂
3446,Giọng yếu cực luôn
3447,dẹng héng ra... i...a ...i...ạ.... dạng héng ra
3448,Thua
3449,lúc khúc hát nhẹ chi pu hát hay hơn.
3450,:))) hát k quen thì đừng có vũ đạo hát k nổi là phải
3451,wtf
3452,"Mk cx k phải hát hay j nhưng thấy chipu hát nó s s ý, hát live nghe giọng tệ"
3453,"Ko dám nghe hết. Chi đừng hát nữa nha, làm ơn."
3454,Chị kiều linh đâu kêu em nana về vs thực tế kìa
3455,hat live do ma baj dac hat nua🖓🖓🖓🖓🖓🖓🖓🖓🖓🖓🖓🖓🖓🖓🖓🖓🖓🖓🖓🖓🖓🖓🖓🖓
3456,tao thíc chipu đóq phim hơn
3457,"Vì hòa bình của thế giới, hãy hủy diệt bom nguyên tử và giọng hát của Chi Pu😉😉😉"
3458,Như kái quần đòi làm ca sĩ ...thảm họa âm nhạc
3459,Twice còn hát hay hơn :))
3460,Tại vọng của chị xủa chị ấy bị khang ý tập như v ai mà k bị
3461,Tại vọng của chị xủa chị ấy bị khang ý tập như v ai mà k bị
3462,Lỡ chị hết hơi thì sao hoặc chị mệt
3463,Mình rất thích nghe Chi Pu hát. Nghe để lấy động lực cầm mic hát karaoke mặc dù m hát dở tệ 😂😂
3464,Ko nghe làm ơn đừng nói gì
3465,Nhớ Là chi pu hát rất hay nhưng  sao kì z
3466,Ko thích Chi Pu làm ca sĩ. Thích Chi lm diễn viên hơn
3467,Tr nghe mún té
3468,bài này rất hay
3469,E xin giơ tay rút lui thôi. Nghe để điếc cmn tai ạ
3470,Hát được như người ta không người ta hát hay mà chê
3471,replay lại mấy lần !!!!
3472,thick chipu dù cô ấy hát thế nào vẫn thấy cảm thấy ok... 🤗🤗🤗
3473,giọng hát trời long đất lở
3474,hát như lzn cx đc lm ca sĩ :)))
3475,Dám đó
3476,Á á á. Á. Á á ! Đập máy ! Mấy nhỏ dưới làm gì la ghê thế
3477,Giọng chi ko lên cao đc như trong video chính thức khổ thân ng chỉnh
3478,iu chipu
3479,Hát dở tệ
3480,Tôi đang  được nghe cái gi đây
3481,Chipu ko có giọng
3482,!có thể là vừa nhảy vừa hát nên mệt thôii🌼
3483,Chắc gì mọi người đã hát hay bằng Chi Pu mà chê
3484,thảm hoa showbiz việt.hát kinh khủng thật.
3485,"Giá như Chi đừng nói câu ""Hãy gọi tôi là ca sĩ "" mà từ từ nỗ lực hơn thì có lẽ khán giả sẽ bỏ qua... Bây h xin lỗi t k thể coi bạn là ca sĩ... 😂😂😇"
3486,K nghe nỗi
3487,gà gáy :v
3488,Việc dũng cảm nhất hôm nay t đã làm là xem cái video này
3489,Mai tao đi lm ca sĩ thôi bây ơi
3490,Tôi thấy nhiều ca sĩ như tùng dương hát là tôi thấy kinh luân ko bao giờ nghe vậy sao ko phản ứng đi
3491,giọng hát kh hay nhưng tong cũng tạm
3492,Lầy quá
3493,Hát ko hay thôi có gì đâu mà soi
3494,kinh khung thiet thua mấy đứa hát karaoke
3495,"Chỉ nên đẹp, ko nên hát"
3496,Em đẹp là được
3497,Nghe thấy hài đến vui cả cái lỗ tai
3498,E mua danh hieu ha chipu e hát nhu cc ý
3499,Giật cmn mình
3500,"Do lỗi kĩ thuật , cái mic có vấn đề. Chi Pu vẫn là nhất"
3501,Nhảy đc đấy chứ. Mỗi tội giọng hát ko đc hay thôi.
3502,"Haizzz đúng là chipu hát dở thật nhưng chúng m phải hiểu rằng nh~ ca sĩ như Hồ Quang hiếu,  Hương Tràm,vv... Lúc mới đi hát thì chẳng khác j chi pu cả"
3503,Cứ tua đi tua lại bố đứa nào xem được
3504,Hát ghê thế
3505,hát như người chết vừa từ địa ngục lên
3506,Mk có thê nghe boi vì mk là pan cua chi pu
3507,K có chút năng khiếu j về nhạc cả
3508,chi pu là em gái lệ dơi
3509,Giọng lạc tông vs bị sét nuk
3510,Sao không dám coi hết tui coi hết nè lãng xet
3511,🙏🙏🙏🙏🙏🙏
3512,Vậy cũng làm ca sĩ được á
3513,Bài hát nhạc hay nhưng giọng thì ns thật như này t cũg hát đc....có khi lắm thành phần kiểu như đã thích ngta thì cả c...t của ngta cũng thích luôn ý
3514,Tuy rằng mình không biết hát nhưng thật sự chipu hát nghe 🎤🎤🎤🎤🎤🎤Tra tấn lỗ tai người nghe quá 🎤🎤🎤🎤🎤
3515,Ủng hộ chị😊😊😊yêu chi pu .có lệch vẫn hơn cái bọn ca sĩ lên sân khấu chỉ biết hát nhép.thật ko xấu hổ chị vừa nhảy vừa hát nên giọng có lệch là phải thôi hay mà kêu gì
3516,Lỡ mình như vậy rồi người ta nói vậy coi có tức ko
3517,Quỳ
3518,quẩy lên nào !!!! dô dô dô dô
3519,Coi xong ói luôn do hon linh ka nhieu
3520,Mãi mãi là fan chipu
3521,tông cao hát không tới ...buồn
3522,không biết chipu đã đủ ghạch đá chưa nhì.
3523,Tự lôi mình xuống thành thảm họa...
3524,Hát hay qua.vo tay nao
3525,Hát live tệ
3526,chỉ đẹp thôi... chứ hát như... :)
3527,Hahaha
3528,😂😂
3529,cai do vo duyen cai do dang ghet vo dao vo duyen dang ghet quy
3530,Hay mà
3531,Tôi ko tin vào tai mình nữa
3532,😂😂
3533,"Jump jump jump jump, Có sai chính tả không các mày"
3534,Giọng hát thần thánh😷😷😷🤒🤒🤒🤒
3535,Được mặt nổi
3536,sao nge nhu đang đọc z...tệ
3537,Trước Angela Phương Trinh cũng ra MV đấy thôi ^^
3538,"thôi Đi ,hát dở đâu phải cái tội"
3539,tui nghĩ chi pu nên làm vũ công thì tốt hơn
3540,Ko biết làm vậy người ta buồn sao
3541,Hát như gà mắt đẻ
3542,Chị bị bệnh
3543,Sao tui thấy hay mà
3544,. Bài gì v ạ
3545,Đáy là âm lai.O với a mà chỉ là hát live thế thôi
3546,Nghe hát xong đau đẻ  cmnr
3547,Giọng hat hãm l
3548,Len cao kg duoc xuong thap cung kg duoc 😣😣😣
3549,CLGT :/
3550,Tra tấn lỗ tai người nghe
3551,Má.. T nge cái gì đó.. Hát như vạy bị ném đá rồi lên khóc than kẻ lể cái kiểu.. Yên phận đi thì âu koá ch
3552,từ nay hãy gọi tôi là ca sĩ vì nghe xong bài này tôi cũng chuẫn bị đi hát rồi. cứ cầm mic là ca sĩ thôi
3553,Giọng hát này có thể làm ca sỹ.... Hazzz thảm họa... Về với nghề diễn viên thôi chi pu ah... Ca sỹ 2 chữ này với e xa vời lắm
3554,Tôi có khi cx lên cao đc hơn chi lun đó
3555,Một bài hát hay.. nhưng để 1 người ko thích hợp thể hiện thì thật tiếc.
3556,cũng đc mad
3557,-vỗ tay ad phát 👏👏👏
3558,Hát đơn giản vậy sao. Đơn giản vậy thì 90% dân số này là ca sỹ chuyên nghiệp.
3559,Ca sĩ mới. Chưa có kinh nghiệm. Không trách được đâu
3560,đôi khu hát dỡ cũng là cách để nổi tiếng
3561,Hát còn k hay bằng t :))
3562,mấy nguoi có nghĩ tới cảm xúc của ca sĩ ko
3563,Làm clip có tâm ghê ))))))
3564,"Tốt nhất làm diễn viên đi cho nó lành , hát ms chả hò , hay đou !à đòi hát"
3565,Ôi vỡ mộng
3566,"Để bt đc r, lặp lại chi ad, rảnh thế .-."
3567,Dx
3568,nghe như mỹ tâm ấy nhỉ @@@
3569,Thảm họa
3570,"đúng là ông trời ko cho ai tất cả, bạn đẹp nhưng bạn lại hát ko hay. Hát hay mà ko xinh thì có thể đi pttm. Còn giọng hát là bẩm sinh rồi, có cố gắng luyện tập mà ko có tố chất thì ko thể thành công đc"
3571,Fan của chi pu cứ xuất ngày bênh chi hoài z người ta tự nêu ý kiến của mk thui mà hát hay bảo hát hay hát dở bảo hát dở. Sao cứ nói là có hát đc như chi ko mà chê. Ko hát đc như chi pu nhưng cx ko ngu mà hát trước mọi người
3572,Không biết nói gì ngoài câu vãi cả đái.
3573,Tại hết lạc tong chúc thôi ko thích thì đừng nghe
3574,đây là hát a
