,Comment
1162,nghe cũng đc mà tới khúc phịt cả lớp là bỏ mẹ đi
1163,390N dislike cái giá khi phá hit idol nhà người khác
1164,"Tao đang xem cái gì vậy. Một cái bản cover xúc phạm idol của tao. 
Xin m luôn đấy bao bài m ko cover m cứ lấy mấy cái bài này ra . Nghe mà như chó sủa vào tai mình. Bộ m chưa chữa khỏi bệnh hả trời. 
M càng ra mv thì m càng tạo ra thảm họa mới đấy-.-"
1165,"Chị à đừng buồn quá...nếu có ai đó khuyên em làm antifan của chị thì chị đừng lo......








Em sẽ nghe theo họ không chối cãi một lời luôn 😃😃😄😄"
1166,IQ đang cao nghe nó cái tuột kinh luôn ....BtS là hay nhất
1167,Fake love bts hay z mà t nghe nó hát khíc đầu là thấy ghét òi
1168,Dislike nhju hơn bình thuong nhở
1169,Vãi cả PHỊCH CẢ LỚP các bác ạ😂😂😂
1170,Ae! đừng chửi nữa like mỏi hết tay rồi
1171,Ghép nhạc  !  Ai thấy đúng cho chị ấy  1 dislike
1172,"Đm. Hát như loz
Phá hit của BTS, nghe xong mới biết thế nào là thảm họa của âm nhạc nó ghê gớm ntn"
1173,"ùmmm tuy k ghét linka nhưng mình thấy ka hát k hay thật,dở:v"
1174,BTS hùng hậu quá lướt cmt toàn Fan BTS :))
1175,Lúc đầu là bạn lúc sau là anh trai nuôi vcl
1176,Giong hat thi cung hay nhung hoi xuc pham nguoi nghe
1177,Dislike 385N và like 61 =)) một con số quá hoàn hảo
1178,Cơ bản là nhạc beat hay quá !!!! Thật là cái lời thì ko sao chứ đến cái giọng thì chỉ muốn vứt luôn điện thoại
1179,Giọng này hát nhạc Hàn không được đâu em ơi. Đi đóng phim Nhật thì được hơn đấy :)
1180,t ko phải fan bts nhưng đừng xỉ nhục bà chị họ t
1181,Này thì cho mz cave nhiu 😂😂😂 tôi nghiệp quơ
1182,Một sự thật là trong kpop k nên động đến bts (cover như loz ý)
1183,Thấy cũng đâu có tệ lắm đâu nhỉ
1184,"khiếp , cái từ fake love bts hát nhanh , giọng càng lên cao . Còn Ka hát thì chậm,  giọng thì trầm không dislike mới lạ , nghe muốn ói luôn"
1185,Có bữa bị mén đá đó chị ăn theo kop
1186,"Linh oi dung lo em se danh tang cj 1








👎😌"
1187,"em thik chị linh ka cực luôn ấy , em muốn gặp chị ngoài đời quá"
1188,Phát âm chuẩn vãi nồi
1189,BTS sẽ khóc hết nước mắt khi xem clip này
1190,"Là army, theo nhận xét thì BTS giống bị xỉ nhục"
1191,"1:53 có ai nghe ""xin em đừng chịch  bậy ko🤣🤣"
1192,"trời ạ 
kỉ lục dislike hơn cả MV #CTKTVN của Sơn Tùng MTP
sky dc an ủi phần nào"
1193,"Phá luôn cái bản hit nhà ngta, phá lời gốc phá nát bét giai điệu, cách hát không hợp"
1194,Cùng nhau dislike
1195,Cj ơi đừng làm bẩn MV của idol em nữa cj ơi
1196,Thôi đi bày đặt quá từ một Fake love mạnh mẽ vũ đạo cực đẹp thành một thảm họa 😡😡😡
1197,Chưa 18 mà độn zú vào làm j cho khó chịu zậy.Nhảy tưng tưng nhìn ngực thì thấy mún ghét🤨🤨🤨🤨
1198,Tr ơi phải ns mõi lần nghe đến câu facke love của cj là nỗi da gà da vịt nổi hết
1199,"Chị hát như cái mu v đó , nhưng mà em vẫn thích chị Linh kave <3"
1200,"các bạn đừng nói vậy với LinhKa,đây chỉ là làm phim thôi mà,nếu các bạn là chị ấy các bạn nhìn thấy comet nói xấu mình chắc các bạn ko tức"
1201,"OMG mị muốn quẳng cái điện thoại vào tường luôn á
còn đâu Fake Love của idol tui~~~~~
haizzzzzzzzzzz"
1202,Từ khi xuất hiện chữ BTS đã thấy không hay rồi
1203,Đợi Cris Devil Gamer reaction thôi
1204,Hình như đó là trưởng nhóm ZERO9 đúng không ???
1205,Học tiếng anh lâu ko bạn ơi
1206,"Chòi oi
Trog MV thì ngực nó bự con trên fb và ngoài đời lepsppppp hơn nho nc chứ ( như sú đàn ông)"
1207,"Top thịnh hành nhờ dislike,Cmt chửi?
Đẳng Cấp!"
1208,"Giọng dưởm bỏ mẹ ra , mày nghĩ mày hát hay lắm à , bố mày là army đấy 😡😡😡👊👊👊mẹ con chó 🐶 🐶 🐶  Muốn tát cho phát"
1209,"Đã hát ko đúng và ko hay cx hát
Anti bà ka đâu điểm danh cái coi"
1210,Hay mà tặng cho chị ấy một   dislike
1211,Nhạc với giọng chả ghép với nhạc gì cả chắc chỉnh giọng nhiều lắm nhiều lắm nhỉ hèn gì thấy dienlike quá trời là đúng rồi
1212,anh trai nuôi ??? tao đang nghe cái gì vậy
1213,"Ai ko thk linh ka 

Nhấn vào đây👇"
1214,Sẽ như thế nào khi BTS vô tình xem được cái video tởm lợm này? :)
1215,"Bạn ơi mình nói này bạn hát thì đừng có mà đăng video như thế ko may người ta bấm nhấm vào sẽ xúc phạm người nghe
 Chúng tôi sẽ luôn ủng hộ bạn bằng cách dislike"
1216,Vl phịch cả lớp:v sinh lí mạnh nhở:)
1217,"Không biết ai giống t không, nghe xong quên mẹ bản gốc, bật lại bản gốc thấy nó lạ vl éo hiểu sao :)))"
1218,Nghe xong là hết mún nghe BTS ... Chỉ mún đi ỉa
1219,Linh Ka dịch hay quá
1220,Mọi người hãy để ý lông mày của Linh Ka vào 1:36😂😂
1221,Đọc comment thấy toàn chửi ko hài vãi kiếm mỏi mắt chẳng thấy lời khen nào tội nhóc nó vl thôi đành theo phong trào vậy (tui là kẻ qua đường)
1222,1:54 xin em đừng ch*ch bậy 😂😂
1223,Một nốt nhạc đầu tiên đã nổi hết da gà rồi.
1224,Chế bài của người ta mà còn chế dở che mặt lại đi cho đỡ nhục
1225,"Phê cần lớp 
Phịch cả lớp
Tàu nghe như vậy xuất tinh sơm đòi phịch cả lớp"
1226,Ai thấy chị Linh Ka dễ thương thì cả nhà cho một Like nhé
1227,"Linh ka ơi m phá hết bài các ca sĩ Việt bây h lại đến các anh cũng không tha làm ơn đừng phá hoại các bài của những ca sĩ, nhóm nhạc nổi tiếng. ARMY như t quá phẫn khi nghe đoạn đầu xl vì nói t m nhưng thật sự ARMY như t k thể chịu đc khi nghe thấy bài này 😡😡😡"
1228,Linh ka là gì chứ hahaha số người ghét nên Ca Ấn
1229,Gịong hát kinh tởm quá. Vậy cũng hát :v
1230,Bài này làm mình hơi ức chế
1231,"Cho mình xin lỗi bấm vào đây nè
👇"
1232,"Linh ơi cố lên dù thế giới có quay lưng lại với e thì 
.
.
.
.
.
Tao vẫn ủng hộ cả thế giới-----"
1233,đi ngang qua phải vào dislike lại 1 phát
1234,Tôi nghĩ mới người quá đáng lắm luôn dù sao cũng là con người với nhau thôi
1235,Tui chưa thấy video nào có dislike còn nhìu hơn like nữa😂
1236,"Ú wào,61N like và 389N dislike.Úi giời,để tui góp vui cùng mấy thím.Dis mạnh tay nào:3"
1237,Công nhận một điều chị Linh Ka sinh ra là để phá hit người khác☺
1238,Má ơi!! Tôi đang nghe cái quần què gì đây? Bản hot của các anh mà nó phá kìa-)))) Tui phải sống sao đây??
1239,"61N lượt like 
388N lượt dishlike 😂😂😂😂😂😂😂😂😂😂"
1240,Linh xinh mà bạn nam đóng cùng chán vãi
1241,Linh ka đã phá tan nát bài fake love của BTS luôn rồi
1242,"ARMY cảm thấy đau khổ 
Làm ơn hãy để bài hát BTS đc yên 😢😢"
1243,Nếu ai còn xem thì cho ka một dislike nhé
1244,"Chỉ số người thích chị Châm sứa 
👇👇"
1245,Chưa nói tới giọng hát dở thế nào nhưng mà   Đoạn rap sao nghe như đọc kinh vậy? 🙃🙃
1246,cover gớm wa ' :)) bài gốc ng ta hay bao nhiêu thì mấy ba mấy má phá bấy nhiêu :))
1247,"Team dislike điểm danh
BTS thì triệu like bài này thì triệu dislike"
1248,Tôi thấy tội cho anh chàng hát cùng quá ! Hát hay vậy mà phải hát cùng linh ka
1249,Fake love: tình yêu giả dối của tôi dành cho Linh ka
1250,Lần đầu tiên tao thấy một video nhiều dislike như này
1251,"Nhìn linh ka j cô giáo dạy khoa,sử, địa tr mình"
1252,Ai disslike đăng kí tại đây ! Yoooolooooo
1253,"Ai anti linh ka 
  👇 nhấn mạnh vào đây"
1254,OMG CHỊ ƠI CHỊ NỠ LÒNG NÀO MÀ COVER BÀI HÁT HAY NHẤT NÀY THÀNH THẢM HỌA VẬY CHI
1255,Ko hỉu nội dung cho lắm. Nhạc cũng k hỉu nói gì luôn😐😐😐 cần lời giải thích
1256,Lời nhạc đ..* liên quan
1257,"Chúng m cứ cmt thật lực Vào cho tao.
Tao bị xóa Tầm 7,8cmt rồi 
Repport Video này cho Tao 
Xin chúng mày đấy
Hãy Dislike và repport
Cố  Lên 500 anh em"
1258,Tr ơi bài của bts đang hay tự nhiên bà này cover một cái mất cả hứng
1259,Hêy bài fake love của anh nhà thì hay triệu like còn linhka thì là phê cả lớp dc triệu dislike
1260,Fây cà lớp hát như nhạc đám ma
1261,nếu các bạn hông thik thì có thể  out ra chứ làm gì mà vô đây bình luận xàm xàm dzạ linh ka hát thì có liên quan đến bạn hay thần tượng của mấy bạn hả đây chỉ là ý kiến riêng của mik vậy thôi TvT
1262,ai dislike giơ tay :v
1263,"Ai ghét Linh Ka bấm vào đây.


👇👇👇"
1264,"Đứa nào like đứa đứa đó bị ngu và mù mắt , mù nhạc"
1265,K cover là k bị ghét
1266,Tặng 1 disslike cho chị linh ka nà
1267,"ARMY đang xem cái Vid quái quỷ này điểm danh đê!!!!!!
Mất mặt :V"
1268,trường mô dạy chị hát vậy chị linh ka :)
1269,"Hình như mình nghe Fake Love thành phịch cả lớp thì phải, ai nghe giống me ko?"
1270,Bản gốc của các oppa hay thế cơ...mà linh ka cover phát ói
1271,Vì chị hát quá hay nên em cho chị một dislike nhé :))
1272,Bả mặc cái đầm trắng nhìn vừa lùn vừa mập
1273,Nhe xong muốn đập luôn cái máy bay
1274,Dam cover bai fake love ha con kia
1275,"6.5M lượt xem
Số Anti
⬇️"
1276,Fake Love mà t cứ nghe Phịch Cả Lớp
1277,Phê cần lá vãi
1278,Mặt rất xinh nhưng khi Linh hát thì tất cả.........như sụp đổ dưới chân tôi.
1279,Fake love dân ca
1280,"Con nào khen hay, Mạnh mẽ ta vả không trượt phát nào =))"
1281,"Nghe đoạn đầu thấy khó nghe,chịu khó nghe thêm chút thấy như ""Cặc""🤣🤣"
1282,Vậy là bài hát của trai nhà đã bị phá hỏng!!
1283,BTS hát hay một 1 tỷ % còn cái này thành 00000000 tỷ tỷ tỷ % hay
1284,Làm ơn đi. bài của bts hay bấy nhiêu thì hát giở đi bấy nhiêu
1285,"Bắt cá bằng hai tay thôi mà
Ko cho bắt bằng hai tay thì bắt bằng mấy tay đây"
1286,em sẽ cho chị ........ 1 dislike
1287,Nghe xong muốn đập mẹ đt.... cười ị
1288,Bài hát hay mà bị giọng hát này phá hỏng
1289,em chỉ biết ngồi khóc phê cần love
1290,Phách cần lớp . Phịch cá lóc  ( là sao ???)😂😂😂😂
1291,"Anh trai nuôi :))
Nuôi để thịt :))
Ôi, não t bay rồi, lời nhạc với nd MV đéo liên quan j😑"
1292,Han trong đây ngầu dữ❤❤
1293,Tưởng hay. vô nghe nó tụng kinh
1294,Ông nội trong clip nhìn trẩu quá kkk
1295,Linh Ka à . Đã k biết sáng tác để hát thì đừng bao giờ chế lấy bài hát của người khác để mà chế
1296,Thà nghe Shopee pi pi pi pi pi cả ngày còn hơn :(
1297,Bài của Trai Nhà mà bả chế thành cái j lun r 😤
1298,"clip này đăng lâu rồi mà tại kênh này đăng
clip gốc bên kênh của chị Linh Ka mà"
1299,#linhdepnhucho
1300,Mỗi lần chị này hát là lần đó sóng gió hơn bão
1301,Huhu chị ơi chị tha cho oppa BTS nhà A.R.M.Y  đi😂😂😂
1302,Má ơi  nghe xg t ko nhớ lời gốc lun
1303,Fake love của ldol tạo mà mày dám chế như vậy ( mất dạy )
1304,Chẳng ra j cả tởm quá🤮🤮🤮🤮🤮
1305,Nhìn con ka cứ như trẻ trâu í
1306,Mấy đứa like là đang cầm ngược đt
1307,Ai thấy Linh Ka hát hay thì điểm danh nha
1308,Làm xấu cả bản hit của người ta
1309,chúc mừng chị đây là MV ca nhạc đầu tiên thấy lượt dislike nhìu hơn lượt like mấy lần
1310,chi ka k nen di hat
1311,Quá tuyệt vời mọi người cố gắng cho lên 100k dislike nào  😆😆😆😆
1312,Con này hát giống nhạc đám ma quá
1313,"Ai ghét Linh Ka 


👇🏻ấn vào đây"
1314,Phê cần lớp!!  ???:D
1315,fake love mà nó hát phê cần love
1316,- mình là EXO-L.. nói thật mình cũng thích BTS.. có nghe bài Fake Love rồi.. giờ con Linh ung thư cover nghe mà mắc ỉa.. mắc chửi thề.. đụ mẹ.. bản nhạc hit của trai nhà ARMY nta mà làm dơ mẹ r.. biểu sao nta k văn tục.. bản thân là EXO-L mà nghe còn muốn chửi.. huống chi là ARMY..
1317,Nghe hãm ko chịu được. Fake love của BTS hay bao nhiêu thì bài này hãm bấy nhiêu
1318,Đm bai cua nguoi ta hay nhu vay cover la do nhu sit
1319,Fake love hay phăng cức lớp
1320,Team like để ủng hộ linh ka điểm danh
1321,"A.R.M.Y à
.
.
.
.
.
Cần giết luôn không 😊😊😊"
1322,"Hát ko đc mà hát làm bẩn quá
Bài của BTS hay bài hát của linh ka ghê sâu sắc"
1323,có Trâm Sứa phải hong dị!!🤔
1324,"Người ta đăng video lên để câu like 
Còn linh Ka đưa video lên để câu dislike!
😂😂😂😂😂😂😂😂😂😂😂😂"
1325,"Ai ghét nó 
Điểm danh nào 
Bài của BTS mà nó hát"
1326,bạn trai không thích điều này
1327,Ô nhiễm 1 bản Hit :))))
1328,"OMG, thật kinh khủng khiếp"
1329,Mn ơi LK sắp cover nữa r tội nghiệp fan BTS r
1330,385 dislike😆 61n like vc thật
1331,"yêu đến thâm đùi 
ai ghét linh ka xin  điểm danh"
1332,"Thứ nhất: Có góp giọng thì ít nhất cũng nên ghi ở tiêu đề là Linh Ka ft Phucson nè=)), trong MV vẫn chưa đủ=)) Chưa kể sai cấu trúc ngữ pháp=))
Thứ hai: Cái này giống Parody hơn, cover thì hơi sai=)) Lời tiếng Việt ngoài từ ""Fake Love"" ra thì hẳn chẳng có gì liên quan luôn=)) Fake Love của BTS nói về tình yêu giả dối khi họ không được sống thực với bản thân, còn của Linh là giả dối vì tay ba nhé=)) Cái này là dựa beat tạo lời và MV khác, nên nhớ Cover với Parody nó không giống nhau=)) 
Thứ ba: Vocal thì t không đánh giá đâu, đoạn rap hơi fail, hơi yếu=)) Với lại hai giọng không hợp nhau lắm=)) Chất lượng video thì ok khỏi chê rồi =)) 
Chỉ là nhận xét=))"
1333,Thực tế trước câu Fake love ... thì nó ghe cx đc
1334,Ai nghe phịch cả lớp dơ tay🤚
1335,Nghe xong là thấy bùn cừ nhay 😏😏😏
1336,A.R.M.Y đầu làm việc chúng ta cần làm nào
1337,hat nghua ca tai
1338,cau fake love nhu dien
1339,Sao cứ thik lôi bts vậy
1340,"Ai ghét luôn Linhka 
👇👇"
1341,"team quên mẹ bản gốc :))
t nhớ bài của trai nhà t mạnh mẽ hay lắm mà sao trong đây nghe như nhạc cải lương vậy :v !?"
1342,kỉ lục dislike
1343,"61N like
388 dislike"
1344,Nghe xong bài nay t ốm cmnr 😐
1345,Nếu ghét chúng m đừg nên xem lũ khốn ☺
1346,Nghe bài này hết nhớ lời bản gốc luôn r
1347,". Bản thân chắc gì đã tốt mà lại phán xét người ta qua vẻ bề ngoài con  người mà ít nhất cũng phải nói chuyện có văn hóa đừng nhìn vẻ bề ngoài mà đánh giá cả một con người =))
Ý kiến riêng"
1348,Cóc rẽ đòi ăn thịt thiên  nga..🙄
1349,"BTS hát Fake Love,  Linh Ka hát phịch cả lớp 😐😐hát cứ như hát cho qua😑"
1350,"phich ca lop , xin em dung chich bay :VVVVVVVVV nhung nguoi dislike dau roi do tay de"
1351,3.30.2019 AI CÒN NGHE KHÔNG ??
1352,Bn em thôi mà ôn ấp như đr
1353,Tởm vãi...làm hỏng cả kiệt tác của người ta
1354,Mỗi ngày tao lại vào đây để cập nhật xem được bao nhiêu disslike rồi!! Ahihi
1355,Anh ay dep trai qua 😍 😍
1356,Mau đạt 400k dislike nào mọi ngừi
1357,Nghe xong muốn đập máy
1358,Khiếp hủy hoại âm nhạc quá
1359,Đứa nào like chắc cầm ngược điện thoại :))))
1360,như c** ế chị linh ung thư à....😟😩😤
1361,Có cái MV thôi mà 62k like tận 391k de VÃI (t cg de nữa hí hí)
1362,Yêu Linh Ka lắm lắm luôn
1363,"như con ngáo ,ai thích ủng hộ mình nha"
1364,Video dành cho những ng bị táo bón nhằm kích thích đi ỉa:))
1365,Linh ka ơi cj dell thấy nhục ak
1366,"Tui rất quan  tâm  Linh ka
Lâu lâu lại bay vô xem bao nhiêu lượt dislike  rồi"
1367,Ăn ở không thì phi cá lóc
1368,Đúng là háy nhái -- bản ng ta hay vậy mà --
1369,Linh Ka kết hợp cùng Zero9 cùng tạo ra thảm họa mới
1370,Tặng chị 1 like😊😊😊
1371,"Hát nghe thấy chán, rap dở hết phần thiên hạ"
1372,Giá mà ở đây có DXY
1373,Linh ka hát fake love như phịch cả lớp ý
1374,"56N like, 359N dislike, xin chúc mừng, chị Ka đã lập được kỉ lục hotgirl có video like ít mà dislike nhiều"
1375,Đây đây con linh ka cover nè chắc người Hàn tưởng đạo nhạc mà bài đặt nói cam đạo nhạc việt lũ khinh người
1376,Nhìn thằng con trai j mà như bê đê  z trời
1377,Mị quên bản gốc r
1378,فيك لااااب
1379,Chị LinKa xướng thật được hơn 300N dislike luôn chúc mừng chị hi vọng chị cầu nhiều dislike hơn
1380,ai ghét linh ka cho một lika
1381,Phê cần lớp😅😅😅😅😅🤣🤣🤣🤣😂😂😂😂
1382,"Còn ai nghe k
Càng nghe càng thấy k hay :))"
1383,Đcm đây chắc mv nhiều dislike nhất vn
1384,"Nói thật mình gặp Linh Ka ngoài đời rồi, ngoan ngoãn hiền lành ăn mặc lịch sự, chứ không phải như mấy page nói đâu... Mong câu chuyện bịa ra của tao giúp các mày vui chứ tao thì... Thôi t  đi gửi mail cho BigHit đây"
1385,Chẳng hay tẹo nào
1386,Ko biết hát gì nữa botay
1387,"Hát như beep ấy, chả ra gì"
1388,Ai ghét con Linh Ka dơ tay
1389,BTS là Fake Love còn đây là Phịch cả lớp
1390,"M im đi m im đi đừng hát nữa ,chỉ lm tao mắc ói mà thôi ,m im đi m im đi trước khi tao cho dislike"
1391,Dep gai nhưng hat dõ quá.minh gop j thoi.linka hat lac thông giong hat ko có cam xuc j het
1392,"Nếu chị thay bài hát của BTS 
Nếu cả thế giới quay lưng với chị em sẽ xách dép chạy theo cả thế giới 
Nếu chị thay bài hát của BLACKPINK MoMoland 
Nếu cả thế giới quay lưng với chị em sẽ xách dép chạy theo cả thế giới
Xin chị đưng làm hỏng bài hát của idol mọi người nhé
Hỏng cả bài hát của idol tôi rùi"
1393,Army nói gian len di no dam bảo cua bts kia
1394,"2 từ thôi ""THẢM HỌA"""
1395,Dịt sai rồi
1396,Xem lại vẫn buồn cười 😁
1397,"ô nhiễm luôn bài hát của nguoi ta rôi 
đm linhka"
1398,-Đừng hiếp dâm tai tao :>>
1399,Đừg nói linh ka hát dở càng nghe sẽ như lozzzzz
1400,Đậu...nghe xong hôm sau mình bị sốt cnmr luôn...
1401,"like thì ít dislike thì nhiêu 


hhhhhhhhh"
1402,Cung hay ma sau khong co tren zing vay 🤔🤔🤔
1403,Muốn ARMY ko văng tục vậy thì xóa mv cover này đi là mọi chuyện sẽ trở lại như lúc  đầu ko có ai chửi ai cả. Ok
1404,2:44 anh trai????
1405,Fake love đi nới là phê cần lớp
1406,Nghe ung thư lỗ tai VL
1407,Hay quá😊😊
1408,Đứa nào vào để dislikes rồi đi ra như tao không? :)))
1409,3:23 châm sứa
1410,Chờ đón 400N dislike
1411,Nghe xong quen mẹ bản gốc luôn ai ghét linh ka thì cho mình một like nha
1412,Linh ka ngày nào cũng mút chim tao
1413,t kh phải A.M.R.Y mà nghe x thấy tội Bangtan của tụi bây quá :(
1414,May gọi hồn tao hả
1415,AI dislike dơ tay✋
1416,"Mình thấy linh ka hát hay mà,"
1417,Khúc đầu phê cần lá
1418,"Nó hát ""fake love"" mà tôi nghe nó hát fucking love :D"
1419,Tặng chị em một dislike
1420,3:56 nhìn gái àk về chết vs bà 😂😂😂
1421,BTS hát hay như thế mà nó cover lại như một cục c*t😏😏
1422,#linkcc
1423,nghe quảng cáo điện máy xanh còn hay hơn
1424,Như loz á hát làm phá mẹ nhạc gốc
1425,Chữ fake love của người ta thì hát nhanh đúng nhịp còn ở đây thì ..... khỏi nói chắc các bạn cũng biết mình nghĩ gì trong đầu mình rồi nhỉ 😑😑😐😐
1426,Lm mất mặt VN quá
1427,Ai vô cái là dislike giống tui ko😆😆
1428,"Đó chỉ là anh giai nuôi của e hoi a à😂😂, Lời viết lại kh hay gì hết, kh hợp với giai điệu, hát kh ra hơi luôn...Thật là ba chấm"
1429,không biết thì đừng có chế.
1430,Nghe cái này xong ám ảnh vãi
1431,Ôi thánh thần thiên địa ơi! Cái bài siêu phẩm của anh nhà tao mà chị ấy phá nhanh như vậy sao? Dù sao cũng cố lên sắp 400N dislike rồi kìa! Để em ủng hộ 1 dislike
1432,3:40 lời vs khẩu hifnh miệng nó hơi hơi s s ấy 😂😂
1433,Em xinnnnnnnnn.......!!!!!!! Chị tránh xa BTS hộ em !!!!
1434,"BTS hát hay bài này 
Linh ka như quần què"
1435,Phịch cả lớp 🤣🤣
1436,Ôi chùi  ôi dislike khủng  thật
1437,Phá bản hit của idol tao rồi
1438,Truyền thuyết kể rằg nếu con này hát thì dislike nhìu hơn like
1439,Tại sao ghét linh ka vậy ạ
1440,Hát dở tệ lu  ko ngờ đây là fakelove lun ý
1441,bài của bts mà đem ra lm trò đùa
1442,Mày định mượn sự nổi tiếng của các anh để kiếm lời cho bản thân à .Mơ đi con mày làm vậy A.R.M.Y chỉ ghét mày thêm thôi tự vươn lên bằng chính thực của mk như các anh mới là đáng là 1 idol hàng đầu hiểu chưa .Kết luộn : ai ghét con linh ka thì bấm👍  nha .
1443,Phê cá lóc... Phê cá lóc... nghe giống Fucking Love 😂😂😂
1444,"Thề luôn anh này mà chăm chút bề ngoài tí, nặn hết mụn, là đẹp trai lắm luôn á, tại thấy a có nét sẵn rồi"
1445,Ngon quá ☺️
1446,Ko hiểu sao lai co những nguoi vào xem rồi chửi ngt nhung the. Ngt lam video. Minh thích thi xem ko thich thi thoi sao lai chửi ngt. Cùng la con người ma ko bt tôn trọng nhau j hết. Vao xem roi Bìh luận nhu nguoi vô hc. Hãy tôn trọng người khác và nghề nghiệp công việc cua ngt đi.
1447,Thanh niên này noi chuyện thật thà .có năng khieu
1448,"Anh làm video rất hay
Cho anh 1 like và 1 subscribe nha 😘"
1449,"chỉ một từ để miêu tả video này thôi "" THÈM ''"
1450,Chúc a thành công trong con đường sự nghiệp
1451,anh quay video con hoi chong mat
1452,Cố lên đi e trai. Ai chửi kệ họ. 9 người 10 ý. Sống cho bản thân chứ k sống cho tụi nó. Làm vì đam mê nên cứ theo đuổi. A cũng muốn làm 1 youtuber nhưng điều kiện và công việc hiện tại k thể làm đc. Chúc e thành công
1453,"E thấy a sống có tình nghĩa ghê luôn
Có hiếu với bố mẹ 
E ủng hộ a , cố lên a nhé"
1454,Anh choi game lien quan di
1455,Like cho a ý nha mn
1456,ham vai
1457,"Nhìn anh hơi giống B-ray, hơi giống  Tôn Ngộ Không teong Hoa du kí. Có nét soái ca😀"
1458,Oi them wa
1459,Ia deo rarara
1460,Giọng cute phô mai que lun
1461,di h xh nv xx
1462,ntn con chui nua ban qua di
1463,Nhìn mặt ông ăn ngon wua y chang PHÊ đá :3
1464,30-4-2019 ai còn xem
1465,Xem video của bạn thì thấy rất tự nhiên k có vẻ giả tạo j cả
1466,"Em mặc áo dài tay, anh mặc áo ngắn tay"
1467,Nhin anh an nhin chay ca nuoc mieng ai dong y diem danh
1468,ngon qua di ak
1469,Link : choaac.com /hppt/...
1470,Lm video j lien quan toi world cup Đi a
1471,Thèm
1472,Thèm Quá Nguyên Ơi :))
1473,Ko thích video cút đừg sủa đúg mjk xin like
1474,"Em chỉ muốn anh thấy cờ men đc rồi 
Fan anh"
1475,ngon nhỉ =))
1476,Tui ko thèm nhá. Chỉ là k sao cho nước miếng ngưng chảy thui
1477,Nhìn ngon vãi
1478,Ngon thế
1479,Ngon thế
1480,Hay pha anh oi
1481,Hèm chãi nuoc mieng
1482,them qua
1483,"cố gắng lên bạn nhé , còn nhỏ làm ytb như vậy là quá thành công rồi , bạn cũng nhiệt tình thả tym cmt nữa , mặc kệ bao nhiêu người chê bai , soi mói vì họ đâu hơn bạn . con người đâu phải ai là hoàn hảo ? mình rất nể và luôn ủng hộ bạn !!"
1484,Ai fan món này điểm danh
1485,Ăn với
1486,"Âm thanh , âm nhạc thì A Nguyên lm rất hợp lý và rất hay ^_^"
1487,anh vu liz rap ve anh day
1488,Nhìn thôi cũng chảy nước miếng 👅
1489,Ngon quá cho xin 1mieng Em ơi
1490,"1,5 tr view gắt"
1491,Có sửu nhi mới vô kênh người ta mà chửi thôi
1492,Like cai nao
1493,nhien anh an ma them
1494,nhin mat tom v
1495,An tat ca may so
1496,Bao nhiêu tiền vậy ah
1497,Anh làm pizza khổng lồ đi
1498,Ngon quá anh ha
1499,Ngon qué
1500,Nghìn like
1501,A nhìu tiên wa
1502,ANH BI BEDE
1503,Cho xin link nhạc ạ
1504,Hi anh
1505,Nướng gà =100000 que diêm đi a
1506,nhin ngon
1507,hay púa anh
1508,cho em voi
1509,Chăm chút mình xíu dii
1510,A ở âu z
1511,nguyen hoc lop may
1512,Them qua di
1513,An giong cho chet doi
1514,Hay them vai
1515,Cho an vs
