socot,MaSP,Name
1,58472,Đồng hồ Nữ Julius Hàn Quốc Dây Da JU1016 JA-844 (Xanh Đen)
2,27146,Đồng Hồ Thông Minh Xiaomi Amazfit Bip - Hàng Chính Hãng
3,71775,Đồng hồ thông minh Smart Watch Uwatch DZ09 - Hàng nhập khẩu
4,2204,Đồng hồ thông minh Smart watch A1 (Đen)
5,35505,Đồng hồ thông minh C1 Plus
6,10884,Bộ đồng hồ thông minh DZ09 tặng viết cảm ứng
7,25721,"Đồng hồ thông minh X86 – Kết nối Wifi, 3G pin khủng 600Mah"
8,42326,Đồng hồ thông minh SmartWatch M9 (Đen)
9,77,Đồng hồ thông minh C3 plus đời 2017 tặng bút cảm ứng
10,5036,Đồng hồ thông minh DZ09 (Vàng) và Viết cảm ứng
11,81313,Đồng hồ thông minh và định vị trẻ em Q50 - Hàng nhập khẩu
12,85362,Đồng Hồ Thông Minh V8 Bluetooth Màn Hình Tròn 1.22 inch
13,3710,Đồng hồ thông minh InWatch Black đời 2017
14,88067,Đồng hồ thông minh SMARTWATCH giá rẻ DZ09 - BẠC.8
15,63588,Đồng Hồ Thông Minh SmartWatch DMT08
16,53460,Đồng hồ thông minh Smart Watch X6 Màn Hình Cong
17,33812,Đồng hồ thông minh đa màu sắc Smartwatch SA01
18,28042,Đồng hồ thông minh điện thoại 2017 (Hồng)
19,40583,Đồng hồ thông minh Smart Watch X6 Màn Hình Cong Cao cấp Tiếng Việt
20,45420,Móc Khoá Đồng Hồ Điện Tử Đèn Led Hiện Giờ
21,83676,Đồng hồ thông minh Q9 có Wifi/3G – Hỗ trợ khe cắm thẻ nhớ TFcard
22,42458,Vòng đeo tay thông minh Smart Band M3
23,5287,Đồng hồ nam Skmei 9069 có lịch ngày chống nước 30m dây thép không gỉ cao cấp
24,32784,Đồng hồ thời trang nam Quartz siêu tiết kiệm pin
25,2108,Đồng hồ nam DIZIZID chống nước mặt siêu mỏng Original Design dây thép lụa cao cấp DZ01
26,24531,"đồng hồ nam halei dây vàng mặt đen,chống nước ,chống xước tuyệt đối"
27,51876,Đồng Hồ Nam Thời Trang Cao Cấp Chống Nước L121 Dây Thép Không Gỉ
28,32183,"Đồng hồ nam chống nước cao cấp có 6 kim , lịch , thép không gỉ QBIN Shop"
29,70340,Đồng Hồ Nam Thời Trang Chống Nước Skmei 9069 ( Vàng) SK 002
30,22427,"Đồng Hồ Nam PANARS USA Kiểu Dáng Quân Đội Cực Chất, Chống Nước Thoải Mái"
31,33158,"Đồng Hồ Nam 0MEGA 075 Dây Da Chống Xước, Chống Nước"
32,65582,"Đồng hồ nam Halei dây vàng mặt trắng,chống nước,chống xước."
33,24133,Đồng hồ nam chống nước DIZIZID mặt siêu mỏng dây thép lụa đen có lịch
34,42511,Đồng hồ nam mặt siêu mỏng DIZIZID dây Titanium có kèm lịch ngày cao cấp DZ3N01
35,73152,"Đồng hồ nam halei 2V vàng chống nước, chống xước"
36,25231,"Đồng Hồ Nam Dây Da Cao Cấp KASHIDUN, Chống Nước 30m"
37,5452,Đồng hồ Nam NIBOSI 2302 Kính Tráng SAPPHIRE - Chống nước cực tốt – Chạy Full Kim
38,22048,Đồng hồ nam cao cấp kính sapphire dây thép kim loại chống xước chống nước
39,27875,Đồng hồ nam DIZIZID DHCN03 chống nước Original Design dây thép lụa thời trang cao cấp
40,33712,Đồng hồ nam thời trang chống nước Skmei ( Đen ) SK 01
41,40407,ĐỒNG HỒ NAM NIBOSI 2309T (1985) DÂY THÉP ĐÚC CAO CẤP CHẠY 6 KIM
42,3457,Đồng hồ nam thời trang chống nước Skmei ( Đen ) 01
43,62801,"Cặp Đồng hồ Halei nam nữ cao cấp chống xước, chống nước tuyệt đối (Giá 1 đôi)"
44,74442,"Đồng Hồ Nam R0LEX R028 Dây Da Chống Xước, Chống Nước"
45,78501,Đồng Hồ Nam Thời Trang Chống Nước SKMEI 9069 ( Trắng ) 01
46,54870,Đồng hồ Nam Thể Thao MINGZHI Nhật Bản Chống Nước Siêu Tốt - 2 Máy Bền bỉ & Mạnh mẽ
47,75411,Đồng hồ Nam ARMY USA Quân Đội Mỹ - Viền Benzen kim Loại siêu bền
48,66524,Đồng Hồ Nam Casio G - Shock GA 110GB 52mm
49,20575,Đồng Hồ Thời Trang Nam Thời Trang - Đồng Hồ SANDA
50,20456,ĐỒNG HỒ NAM RỒNG FNGEEN 3D DÂY THÉP KHÔNG GỈ BẢN DOANH NHÂN
51,88240,ĐỒNG HỒ NAM R0LEX_JJK99
52,78353,Đồng hồ nam dây kim loại Casio Anh Khuê AE-1200WHD-1AVDF
53,16466,Đồng Hồ Nam VICERO Cao Cấp 6 Kim Chịu Nước Thoải Mái 5 Màu Để Lựa Chọn
54,6721,Đồng hồ Thông Minh Sức Khỏe Nam Skmei 1227 Smart Watch Pin 1 Năm
55,23307,Đồng hồ nam dây kim loại Casio Anh Khuê AE-1200WHD-1AVDF + Tặng dây da bò cao cấp
56,20086,Đồng hồ nam dây thép lụa đen DIZIZID mặt siêu mỏng Original Design DZTV
57,2114,Đồng hồ Nam SESOP Châu Âu - Vân Sọc Đẳng Cấp + Tặng kèm pin dự phòng
58,74681,Đồng hồ Nam ROMA ITALY Kính Tráng Sapphire Full Kim – Dây thép đúc đặt cao cấp
59,50180,Đồng hồ nam siêu đẹp TTP-217(mặt trắng))
60,76667,Đồng hồ nam mặt Original siêu mỏng dây thép lụa đen cao cấp DIZIZID DZ01
62,8170,Đồng hồ thông minh Smart watch A1 (Hồng)
63,67863,Đồng hồ thông minh InWatch C plus đời 2017
64,88272,"Đồng hồ thông minh X8 kết nối Wifi,3G hỗ trợ camera kép"
65,57076,Đồng hồ thông minh Smart Watch A1 gắn sim độc lập (Xanh lá)  
66,5001,Đồng hồ thông minh SmartWatch DZ09 chính hãng giá rẻ
67,80277,Đồng hồ thời trang nữ cao cấp dây kim loại chống nước thương hiệu Dimini (blue)
68,11686,Đồng hồ thời trang nữ cao cấp dây kim loại chống nước thương hiệu Dimini ( gold )
69,50602,"Đồng hồ thời trang nữ Geneva , đồng hồ 6 kim"
70,61454,Đồng hồ nữ Halei Hl236 V6 mặt trắng chống nước
71,55631,Đồng hồ nữ Dây Kim Loại Giá rẻ Chống Nước BS Bee Sister Đính đá M020 (Kèm Hộp)
72,3887,Đồng hồ nữ thời trang cao cấp Mobangtuo dây nam châm chống sước chống nước
73,87154,Đồng hồ nữ Halei HL168 V6 màu vàng chống nước
74,83081,Đồng hồ nữ dây thép màu vàng V6 001 chống nước HALEI
75,63212,"Đồng Hồ Nữ CURREN Chống Nước, Dây Thép Lụa Cao Cấp"
76,15371,(SIÊU GIÁ 99K) Đồng Hồ Nam JENISES - Hiển Thị Lịch Ngày Cao Cấp
77,22108,(Siêu giá 30.04) Đồng hồ Nam ROMA LUXURY Kính Sapphire – Dây CHARM đúc đặt đẳng cấp
78,2320,Đồng hồ Nam ROMA ITALY LUX Kính Tráng Sapphire Full Kim – Dây thép đúc đặt cao cấp
79,17256,Đồng hồ nam JUN YU dây da thời trang (Đen)
80,2423,"Đồng hồ nam NIBOSI 1985 dây da trơn chạy 6 kim, hàng full box"
81,76680,"Đồng hồ Nam Nibosi cao cấp (Ni2309 dây đúc, máy chạy 6 kim)"
82,82526,Đồng Hồ Nam SANDA Thể Thao Dây Silicone Siêu Bền
83,51321,Đồng hồ Nam ROMA ITALY Kính Tráng Sapphire
84,72630,Đồng hồ Nam NIBOSI LUXURY Kính Tráng SAPPHIRE
85,41423,Đồng hồ nam NIBOSI 1985 dây thép lưới mỏng cao cấp full 6 kim lịch ngày (full box)
86,53325,"Đồng hồ thời trang nam 6 kim , lịch , thép không gỉ QBIN Shop mới nhất 2018"
87,53045,Đồng hồ thông minh gắn sim SA01+ Tặng kèm 1 bút cảm ứng
88,26674,Đồng hồ thông minh SMARTWATCH SA1 (Hồng)
89,64708,Đồng hồ thông minh A1 giá rẻ
90,58075,Vòng đeo tay thông minh Smart Band M3 Đo Nhịp Tim kết nối Bluetooth ( green )
91,6010,Đồng Hồ Thông Minh Dz09 Thế Hệ Mới
92,12845,Vòng đeo tay thông minh M2 Đo Nhịp Tim kết nối Bluetooth
93,17762,MIBAND 3 ĐỒNG HỒ THÔNG MINH - PHIÊN BẢN TIẾNG VIỆT
94,45885,Đồng hồ Thông minh Chống nước quản lý và định vị trẻ em DF25 - Hàng nhập khẩu
95,24670,Đồng hồ thông minh Smart watch DZ09
96,56658,Đồng Hồ thông minh Smart Watch Uwatch DZ09 (Vàng)
97,25443,Đồng hồ thông minh SX6 màn hình cong (Trắng)
98,10620,Đồng hồ thông minh SMART WATCH SA1 - màu trắng
99,25556,Đồng hồ thông minh Smart Watch DZ09 Đen
100,22482,Đồng hồ điện thoại SmartWatch DZ09 (Đen)
102,85870,"Đồng hồ thông minh V8 - Nghe gọi nhắn tin 2 chiều, Nghe nhạc, Chụp hình"
103,81706,Đồng hồ thông minh Smartwatch PUTOCA XY08 Pro
104,48831,Đồng hồ nam dây vải PGH02 (Xanh phối đỏ)
105,86865,Đồng hồ nam dây da kính 3D
106,87614,Đồng Hồ Nam AERNSI Dây Titanium - 2 Lịch Cao Cấp
107,66318,Đồng hồ nam dây thép cao cấp Mặt Rồng Vàng Fullbox
108,20146,Đồng hồ nam mặt siêu mỏng DIZIZID dây Titanium DZ3N01
109,83875,"Đồng hồ nam, đồng hồ nibosi 2309 + Vòng tỳ hưu phong thủy"
110,15284,"Đồng hồ nam Nibosi 1985 dây đúc, thép không gỉ (Ni2309 dây đúc )"
111,11121,Đồng hồ nam dây thép đặc đính hạt cao cấp Nibosi 2315 (fullbox)
112,78815,"Đồng hồ nam, đồng hồ Nibosi 2309 vàng mặt đen"
113,81678,Đồng Hồ Nam Nibosi 1985 Dây Lụa- Đồng Hồ Nibosi Thời Trang Cao Cấp
114,27033,Đồng hồ Nam SESOP RYKER Đính đá sang trọng
115,71662,"Đồng hồ nam Nibosi 1985 dây đúc, thép không gỉ (NIbosi 717 dây đúc )"
116,10874,Đồng hồ nam NIBOSI 1985 dây da cao cấp
117,12627,Đồng hồ nam NIBOSI 1985 dây thép đúc chạy 6 kim business MDL-2309S
118,14464,Đồng hồ dây da nam thời trang 697
119,10414,Đồng hồ nam ORLANDO dây thép có clip
120,6444,Đồng hồ nam dây thép đen mặt siêu mỏng DIZIZID DZ24
121,81711,Đồng Hồ Nam Khắc Rồng 3D Sang Trọng Dành Cho Quý Ông Đẳng Cấp
122,75087,Đồng hồ nam NIBOSI 1985 dây thép đúc cao cấp chạy 6 kim MDL-1985S
123,71823,"Đồng hồ Nam Nibosi 1985 cao cấp (Ni2322 dây đúc, máy chạy 6 kim)"
124,65180,Đồng hồ cơ nam FNGEEN F99 dây kim loại cao cấp
125,13124,"Đồng hồ nam Nibosi 1985 dây đúc, thép không gỉ (dây lưới)"
126,61158,Đồng hồ nam dây thép đặc dạ quang Ontheedge 036
127,66075,ĐỒNG HỒ NAM CHẠY 3 KIM FNGEEN FN001
128,88404,Đồng Hồ Nam CUENA 14 Mặt Đen Dây Da Sang Trọng
129,73661,Đồng hồ nam mặt rồng vàng trắng cao cấp
130,42455,Đồng Hồ Thông Minh DMT09
131,488,Đồng Hồ Cảm Ứng Giá Rẻ DZ09
132,74655,Đồng hồ thông minh V8 mặt tròn sang trọng
133,70605,ĐỒNG HỒ NỮ VENUS KOREA Viền Đá Sang Trọng + TẶNG HỘP & PIN
135,61708,Đồng hồ nam NIBOSI 1985 dây da trơn chạy 6 kim MDL-1985L (full box)
136,55065,Đồng hồ nữ dây kim loại Be.Watch Hr1741 (Vàng)
137,55724,Đồng hồ thông minh Smart watch A1
138,66615,Đồng hồ nam thời trang chống nước Skmei ( Đen) SK 010
139,67586,Đồng Hồ Thể Thao Led Skmei 1251 chống thấm nước ( Màu đen) + 01 hộp cứng SKMEI
140,35271,Đồng hồ nữ platrium kiểu dáng sang chảnh ( đen )
141,46030,Đồng hồ nữ dây da tổng hợp Geneva GE003 (Trắng)
142,78572,Đồng hồ nam dây thép lụa đen mặt siêu mỏng DIZIZID có lịch ngày cao cấp (Full hộp) - Style lịch lãm DZ3N001
143,78231,[Có video quay thật] Đồng hồ nam dây thép không gỉ cao cấp Nary 2561 (Nhiều màu lựa chọn) + Tặng kèm voucher bảo hành IDMUASAM
144,26365,Đồng hồ nam đèn led phát sáng JIS 6541 (Mặt đen) + Tặng kèm voucher bảo hành IDMUASAM
145,74380,Đồng hồ nữ dây cao su cao cấp JIS 2162 (Dây đen mặt trắng) + Tặng kèm voucher bảo hành IDMUASAM
146,58566,Đồng hồ nam thời trang chống nước cao cấp Skmei 9096 ( Xanh ) 003
